text	factuality
No meds at this time, doctors think I'm just another nut patient.	EXPERIENCE
Sometimes just wish to die, frustrated to the end.	OPINION
Sorry for my english, I come from Europe.	FACT
God bless you all!	NOT_LABELED
Primus75.	NOT_LABELED
I was dignosed with Crohns over the Christmas holiday 2011 after spending the night in the ER, with what I thought was a violent case of the stomach flu.	EXPERIENCE
I do not have medical insurance therefore have not been to my Primary Care Dr. for any follow up.	EXPERIENCE
I seem to get sick to my stomach ALL the time.	EXPERIENCE
I could be riding in the car and all of a sudden I have to throw up.	EXPERIENCE
I'm not one for taking ""Modern or Western medications""would love to treat this as homeopathically as possible.	OPINION
I go from feeling great to feeling like a have the flu in a matter of minutes sometimes.	EXPERIENCE
My husband just thinks I've turned into a complainer and has little to no sympathy, which is emotionally rough.	EXPERIENCE
Any thoughts or words of wisdom from any Crohns Vetrans?	OPINION
Heide.	NOT_LABELED
hi, my daughter has the same thin vomoting acid, she is on sulfolk anti inflamitrys and that is all	EXPERIENCE
she waz doing well on probiotics,everymorning, vitaminc with glutamine,and then red paw paw, mist a couple weeks while she waz in london and has now bin sick 4 over a month.	EXPERIENCE
in the last week and a half she has bin vomiting everytime she eats a little, but its like acid, water, bin to docs, nothing else has bin given, im a bit worried she has lost 4 kilo in three days.	EXPERIENCE
red paw paw is one food that is staying down.	EXPERIENCE
also gingerbeer mkes her feel betta.	EXPERIENCE
i dont agree with sterriods either, but would use for 3 days in an emergency, if i felt her bowls where gonna burst.	EXPERIENCE
this is something new for us, the vomoting thing, if anyone has any ideas would be great, she waz only diagnosed 4 months ago.	EXPERIENCE
x jade.	NOT_LABELED
Buy aloe vera juice, drink it before bed.	OPINION
Not the sugary drink but the stuff at the health food store.	OPINION
Cut out wheat from your diet....it inflames.	OPINION
Corn is also iffy.	FACT
Grains are hard on the system.	FACT
Ask your doctors to put you on the steroid treatment and good luck.	OPINION
Buy aloe vera juice, drink it before bed.	OPINION
Not the sugary drink but the stuff at the health food store.	OPINION
Cut out wheat from your diet....it inflames.	OPINION
Corn is also iffy.	FACT
Grains are hard on the system.	FACT
Ask your doctors to put you on the steroid treatment and good luck.	OPINION
Google wheat and how horrible it is on the body.	OPINION
Go glutten free and cut grains as low as possible.	OPINION
I agree with thr cannibis!	OPINION
Its the ONLY thing that helps me!	EXPERIENCE
Also yogurt and rice.	EXPERIENCE
I have been on Orednisone at high doses, for 30 years as I sit here, with 8 fractured vertebrae and 2 fractured Prlbis', I am MOW wondering if it was worth it!	EXPERIENCE
HOWEVER my Rheumy has dropped my Prednisone from 80 mg/ day, to 7 1/2/ day, and I feel HORRID!	EXPERIENCE
I, too, started vomiting ALOT!!!	EXPERIENCE
As this is my LEAST favorite exercise, I begged the ER doc, the other day, for something for it- he gave me some sublingual Xofran tablets!	EXPERIENCE
What a MIRA CLE!!!	OPINION
I also take Lomotil, daily, and at times must need it up with Imodium.	EXPERIENCE
Multi Symptom tabs.	FACT
He also have me a TRUE wonder drug, called, Hydroscyamine- which stops the gramps, even before it's through dissolving!	EXPERIENCE
I take Entocort, too, and it helps the intestines tremendously, but it's cost prohibitive, at $1,700.00/ month!!	EXPERIENCE
I also take Lialda, an anti inflammatory that act just in the gut! Love it!	EXPERIENCE
Even with all of these tools, I am having to wear a Depends, 25/8!!!	EXPERIENCE
I'm only 55, and haven't found anyone yet!	FACT
Not going to, this way, either!!!	NOT_LABELED
Lol!	NOT_LABELED
I, too, vomit watery bile- which I hate!!!	EXPERIENCE
The Zofran has helped that , my other problem, tho, is that my Medicare ins. Only covers 6 prescriptions/ month!!	EXPERIENCE
I now take 38!!!!	EXPERIENCE
Am totally disabled, and cannot afford that much to spend just on scripts- every month!!!	EXPERIENCE
I had my colon removed in 2004 because of severe ulcerative colitis.	EXPERIENCE
My surgeon was able to perform a Restorative Proctocolectomy, so I have an internal J-Pouch.	EXPERIENCE
Life with the J-Pouch has been tons better than with the rogue colon, but it has never been 100%.	EXPERIENCE
My doctor and I have tried all kinds of medications to get it to calm down, Flagyl, Amitriptylin, Glycopyrrolate, Xiflaxin.	EXPERIENCE
The only thing that has seemed to help was Ciprofloxacn, which then stopped working after a time and now works again in combination with Tindamax.	EXPERIENCE
My surgeon would prefer me not to be continuously on two antibiotics and I would certainly prefer that too, but the alternative is not fun, cramping, constant bathroom visits and the worst is leakage at night.	EXPERIENCE
Does ANYONE have any remedies, natural therapies, a different medication to suggest, really anything?	OPINION
I have also tried a course of probiotics while not taking medication and my pouch just continued to get worse.	EXPERIENCE
Have they looked at your diet?	FACT
You may be eating too much fiber, sugar and/or spices.	OPINION
I've had my pouch for 15 years and definitely the first year or so was tough but I eventually got into the habit of eating bulking foods (oatmeal, marshmallows, apple sauce, meats, eggs) and avoided heavy fiber foods and spices.	EXPERIENCE
Eventually I've been able to eat anything but occasionally if I have too much spicy or too much salads or sugar I run into problems.	EXPERIENCE
I assume you take an anti-diarrheal?	FACT
Thank you for your response.	NOT_LABELED
Unfortunately, even when I had Ulcerative Colitis, diet never seemed to make a difference.	EXPERIENCE
However, I do avoid spicy foods because they do bring pain.	EXPERIENCE
As far as anti-diarrheals, I have tried Imodium, but it seemed to make me feel like I had a blockage or constipation, but maybe I was taking too many or something.	EXPERIENCE
Thank you for the thoughts; I'd definitely appreciate any more you might have.	OPINION
There are some other prescription drugs your doctor can give you - antispasmodics.	FACT
Do ask for those.	OPINION
They can make a big difference.	OPINION
has anyone ever gone back to illeostomy after having on going problems with j- pouch ?	FACT
need advice,i am thinking about removing j pouch,	OPINION
never get enough sleep,,up 5-8 times a night,,always looking for bathrooms, anal area always sore ,,on going hemroids, occassional fistuals, on antibiotics ,	EXPERIENCE
just wondering if life is any better with out j pouch ,,looking for answers,,,please someone HELP.	OPINION
Thanks cka58.	NOT_LABELED
I have UC and Ive had a j-pouch for 6 years now..	EXPERIENCE
And have had nothing but problems.	EXPERIENCE
I had pouchitis which you talked about and have been put on the same antibiotics for years at a time and nothings worked.	EXPERIENCE
My doctor is now going to try the drug 6mp because I have fistula's and ulcers.	EXPERIENCE
He said if that doesnt work the drug called Remicade would be his 2nd option.	EXPERIENCE
Maybe you should ask your doctor about those two drugs as well.	OPINION
Cka58 I feel your pain its like a never ending battle with UC.	OPINION
Trudie thats strange you mentioned you felt like you had a blockage after taking Imodium.	OPINION
because after my surgery maybe 6 months after they started me on that and I ended up getting a blockage which they had to go in and correct.	EXPERIENCE
I always thought it was from that drug as well.	OPINION
If you want to slow down ur bathroom visits i'd say take metamucil.	OPINION
Hope everything works out for the best...	OPINION
I have Chronic Pouchitis.	EXPERIENCE
I have had the pouch for 10 years now.	EXPERIENCE
I have tried everything from diets to anit-diarrhea meds, anitbiotics and remicade.	EXPERIENCE
Nothing has yet worked for me.	EXPERIENCE
Have had the bag option in mind, but trying to hold off as long as possible.	OPINION
I'm only 28.	FACT
I will be going over a reconstructive surgery for a possible new pouch.	EXPERIENCE
I am up every 2 hours throughout the night and need to plan my day around the bathroom.	EXPERIENCE
I am an athlete and this is probably the worst hold back ever.	OPINION
Any thoughts??	NOT_LABELED
I had what I thought was chronic pouchitis.	EXPERIENCE
The meds were not helping.	EXPERIENCE
I found that I had an overgrowth of yeast in my body.	EXPERIENCE
Went on a few weeks diet of no yeast, gluten, sugar and added probiotics and took a supplement from a naturopath which killed the yeast and then went back to a normal diet.	EXPERIENCE
Talk to your doc about xifaxan.	OPINION
It's an antibiotic that only impacts the digestive tract.	FACT
I've had chronic pouchitis since getting my pouch 11 yrs ago, and this is the only thing that helps.	EXPERIENCE
I also take a small amount of probiotic in the form of yogurt every day.	EXPERIENCE
That's counterintuitive with the antibiotic, but they seem to strike a better balance that with the antibiotic alone.	EXPERIENCE
I have had j-pouch since 1991 and last few years have had very bad pouchitis overflow incontinence.	EXPERIENCE
Pouch nurse gave me a Medina cathater which is a tube with which you can empty the pouch.	EXPERIENCE
I carry it with me all the time and has helps me keep the pouch empty.	EXPERIENCE
I have also started on a no sugar, no milk, no wheat diet plus daily use of VSL3 probiotic.	EXPERIENCE
Seems to be helping, especially the Medina cathater which stops (not completely but 80%) the incontinence.	EXPERIENCE
I recommend it.	OPINION
Hi, my name is Serina.	NOT_LABELED
I am 19 years old and I have a j-pouch too.	EXPERIENCE
I have had mine for about a year, and i have pouchitus.	EXPERIENCE
I am on humira, which helped at first but eventually stopped working.	EXPERIENCE
I went to see a nutritionalist who works with people who have chrones, bid, and uc.	EXPERIENCE
She has me on a diet that eliminates ALL grains.	EXPERIENCE
I eat a lot of cooked vegetables, protein from fish and chicken, and this wonderful bread called ""almond bread"".	EXPERIENCE
You make it from ""almond meal"" that you can find at trader joes.	FACT
It is pretty much just pure almonds and eggs.	FACT
It is amazing and never hurts my stomach!	OPINION
I strongly suggest you make some.	OPINION
Just type in ""almond bread recipe"" in google.	FACT
Also probiotics, aloe Vera capsules, and a multivitamin are good.	OPINION
If you can afford it, go to some yoga classes, get some reiki, and do some meditation.	OPINION
Hope this helps!	OPINION
I've had my pouch for over 15 yrs. I've had nothing but problems with it.	EXPERIENCE
We've tried all the above.	EXPERIENCE
Still have pouchitis every day & worse.	EXPERIENCE
I haven't had a nights rest in all that time.	EXPERIENCE
I've simply come to terms with it.	EXPERIENCE
For better or worse this is me.	OPINION
I try to think of all the things I would have missed altogether without it.	OPINION
I am a 51 yr old female who had UC most of my life.	FACT
In 2007 I had a total protoctomay w/J-pouch and my life couldn't be any worst.	EXPERIENCE
I have nothing but complications especially with pain.	EXPERIENCE
I have severe pain and spasms in my anal and pouch area that if not treated I'm sure I would die from heart failure because this pain is absolutely intolerable.	EXPERIENCE
I have been on high doses of morphine since the day of my surgery.	EXPERIENCE
I take 15mg of morphine every 8 hours plus breakthrough throughout the day as needed.	EXPERIENCE
I have pouchitis all the time and now my pouch is ulcerated.	EXPERIENCE
I have incontinence through out the night.	EXPERIENCE
Go to the bathroom at least 7-8 times a day.	EXPERIENCE
I use to be a runner but now can have no physical activity because of my incontinence and frequent bathroom stops.	EXPERIENCE
If I do anything physical or lift anything heavy I through myself into spasm which then require more morphine to manage my pain.	EXPERIENCE
I'm tired, depressed and scared to think this is my life.	EXPERIENCE
I have been seeing Dr. Bo Shen of the Cleveland Clinic who gives me alcohol and kenelog injections into the cuff of my J-pouch evert 6-months and at first this seemed to help with some of my pain and I was able to decrease my morphine intake.	EXPERIENCE
However, lately I feel little relief.	EXPERIENCE
I haven't heard anyone talk about pain.	FACT
Really need some advice and encouragement.	OPINION
BG.	NOT_LABELED
I had a brooke ileostomy before I got my ""K"" pouch and I wish I never made the change.	EXPERIENCE
I've had pouchitis over and over and it really wears you down.	EXPERIENCE
For me the ileostomy wasn't a huge issue but the wife wasn't too happy.	EXPERIENCE
Sadly the wife is now my ex and I live with this pouchitis everyday.	EXPERIENCE
Hope to make the change back and eat whatever I want and no longer have to deal with the pain.	OPINION
This procedure is not well known but is excellent.	FACT
Go to www.bcir.com and check it out if you are tired of your J-pouch not working correctly or still having to search for bathrooms every hour or so.	FACT
Or if you tired of dealing with your Brooke Illeostomy not staying on or damaging your skin.	FACT
I have had UC for 15 years and finally all of the meds stopped working.	EXPERIENCE
When my Gastro told me that I needed to have my colon out I was devastated.	EXPERIENCE
I had researched the ""bag"" and was not pleased with the results.	EXPERIENCE
I also was not excited about the J-pouch option as it did not seem to improve the quality of life much and so I looked further into the BCIR option.	EXPERIENCE
I had a total proctocolectomy on 3/21/14 and life is getting better.	EXPERIENCE
The BCIR is similar to a Koch pouch with an improved valve design so there is no incontinence/leakage.	FACT
I wish more Doctors knew about this option to at least give us, their patients more choices.	OPINION
Dr. Ernest Rehnke from the Palms of Pasadena Hospital in St. Petersburg, Florida is an extremely talented surgeon and the staff at the Palms is fantastic.	OPINION
Please at least check into this option and make an informed decision.	OPINION
I'm glad I did.	OPINION
The only thing that works for me are a good Pro-biotic pill.	EXPERIENCE
and drink Dan Active, one Dan Active morning & bedtime.	EXPERIENCE
Avoid greasy foods!	OPINION
Drink lots of water.	FACT
Red meats are hard to digest so tend to cause a blockage.	FACT
Baked chicken, fish, & turkey are okay.	OPINION
Avoid too many sweets & may sound silly, but chew your food well before swallowing.	OPINION
I am a 32 yera ld female with crohns.	FACT
within the last week I have had extreme joint pain and inflamation.	EXPERIENCE
in my hAnds.	FACT
My knees hurt and I have lost all feeling in my left middle finger.	EXPERIENCE
When I sleep, or try to sleep, both of my arms and hands go numb.	EXPERIENCE
I got blood work and my ana count is high.	EXPERIENCE
They want me to see a reuhmatoid doctor, I am wondering if this isn't crohns related,,,any help for a sister would be appreciated.	OPINION
Definitely Chrohn's related.	OPINION
I'm 38 and most days my knees feel like they are 102.	EXPERIENCE
My GI also wants me to see Reuhmatiod specialist.	EXPERIENCE
I'm reluctant because it means more doctors, and more meds.	OPINION
I already have to get up an hour early to take all my morning meds.LOL.	EXPERIENCE
What a yummy breakfast!	OPINION
I have seen that a few people take Aleve to help with this.	FACT
My GI claim that is the worse thing to take with Crohn's.	FACT
I was taking it and getting some relief, until he said that.	EXPERIENCE
hey i understand your pain, i have crohn's as well and i've been dealing with arthritis on hands and feet and my ring finger on both hands go numb every day along with pain that radiates to my elbow.	EXPERIENCE
i have to take pain killers to feel better and able to work , so don't feel alone i am there with u.	OPINION
hang in there!!!!!!!! kathy.	NOT_LABELED
I also have crohns and I hear you.	FACT
I have such pain in knees, hands,neck and especially my lower back.	EXPERIENCE
Only take tylenol as recommended by gastro doc.	EXPERIENCE
Advil causes bleeding, etc. ladybea.	FACT
I was diagnosed with Chrons in 11/07.	EXPERIENCE
The only reason I am at this point is that in June 07 I began having wicked arthritis in my entire body.	EXPERIENCE
I could barely move, pick things up, etc.	EXPERIENCE
After many doctor visits, appointments with numerous specialists (including an RA specialist, after taking many ugly meds with bad side effects) I was sent to a GI and diagnosed with Chrons Colitis.	EXPERIENCE
He said that the arthritis is a direct side effect of the Chrons.	EXPERIENCE
I only got my life back after a crazy regimine of steroids and Celebrex.	EXPERIENCE
Now I am being weened off of the steroids (it is painful and the arthritis flares up every now and then) and am on Imuran and am bouncing back.	EXPERIENCE
Unfortutanely I still have to deal with the issues with the damage I sustained when my immune system decided to attack all my joints.	EXPERIENCE
I feel for you all, and it seems mostly ladies?	OPINION
I have had Crohns for over 25 years and have had three resections in 1984, 2001 & 2007	EXPERIENCE
I have been on various drugs over the years and had good and bad years.	EXPERIENCE
For around a year now I have been on infleximab by infusion, Methotrexate tablets as well as taking Questran to help digestion, folic acid and 3 monthly B12 injections.	EXPERIENCE
I have had some trouble over the years with stiff joints in my hands, mostly in winter, but around four months ago I started getting real pain in my hands and fingers followed by them swelling, this then started in my feet and ankles, legs, knees, arms elbows and shoulders and seems to move from one place to the other on a 2-3 day basis, it sometimes even changes from being severe to the point of not being able to use my hands to just a slight pain and completely moved to, say a knee or a foot over night.	EXPERIENCE
My only respite now is too many pain killers and complete rest, as soon as I work (I don't to anything too manual these days) or take exersize one or another, or several of my limbs will be extremely painfull or sore to touch very soon after.	EXPERIENCE
The pain is not confined to my joints, in fact there is not always pain in the joint, more around it and in cases up my arm or leg, more like, and it changes, tendon or muscle pain.	EXPERIENCE
Yesterday my ankle was swollen and painfull to move, enough to cause me to limp and my calf muscle felt as though I had a severe cramp in it every time I put my foot to the floor.	EXPERIENCE
The strangest thing is this continuing changing of the area that gives most pain.	OPINION
I am coming to the end of my tether with this, my Doctors keep telling me its to do with the Crohns, we will have to do more tests etc.etc.	OPINION
My Crohns has been very good as far as I am concerned for some time now, although I have recently had a pillcam which seems to reveal that the Crohns is active but there is nowhere to go medically, looking like the only option is more surgery.	FACT
If the surgery would get rid of the new symptoms while the Crohns stays at bay, great but I am now 54 and not keen on yet more surgery when I feel in myself that this is a seperate issue from the Crohns.	OPINION
There are apparently more than 70 kinds of arthuritis, is it possible that this has nothing to do with the Crohns and should be investigated on its own symptoms?	OPINION
I find if you have Crohns any other ailment at all is lumped in with it, ""Oh that's to do with your Crohns"" is sometimes a very convenient answer.	OPINION
Any help at all would be appreciated, if any one else experienced anything like this or any proffesionals out there have heard of similar symptoms please get in touch through this site or direct to ***@**** Thanks.	OPINION
Wow!	NOT_LABELED
It's nice to hear that I am not really crazy.	OPINION
I was diagnosed with Ulcerative Colits and Relapsing Polychondritis in 2009 and I've had so many side issues I don't know which is to blame.	EXPERIENCE
It's very difficult trying to work or even explain to some people what is going on with my body.	EXPERIENCE
Some days I wake up and everything is just fine and some days I'm drained because I may have spent half the night in the bathroom or I wake up to some part of my body being swollen.	EXPERIENCE
Sometimes it's the joints but more often than not it's the area around the joints (from the RP).	EXPERIENCE
In the last year I've had swelling/inflammations in my nose, ear, face, neck, elbow, wrists, arm, fingers and toes.	EXPERIENCE
One day both of my ankles were totally swollen and I was confined to bed which is very difficult with UC.	EXPERIENCE
It's become a running joke each day to see what part of my body is sore or inflamed as I'm trying to see the humor in all of this to keep from crying.	EXPERIENCE
Anyway, just wanted to say it's actually good to know that I'm really not alone in this craziness.	OPINION
Thanks for sharing everyone...	NOT_LABELED
I was diagnosed with Crohn's in 1996.	EXPERIENCE
Resection, steroids, remicade, humira all have helped with the digestive symptoms, but two years ago started having the SAME symptoms as nace1.	EXPERIENCE
I am at my wit's end with this joint/muscle pain/stiffness/swelling.	EXPERIENCE
I feel like I'm 100 years old.	OPINION
I had some relief with the Humira, but have been hospitalized TWICE with pneumonia in the last six months and was told.	EXPERIENCE
I have to go off all the immunosuppressant drugs and am praying the digestive symptoms will not return.	EXPERIENCE
In the meantime I am turning into a Vicodin junkie, as it is the only thing that remotely takes the edge off the pain.	EXPERIENCE
Thanks for letting me vent, and if anyone has any suggestions, I AM WILLING TO TRY ANYTHING AT THIS POINT.	OPINION
Blessings to all...	NOT_LABELED
I have had Colitis for 27 years.	FACT
The flare ups for 10 years were minimal..	EXPERIENCE
Sulfasalazine was the medicine of choice back then.	EXPERIENCE
Early 90's a flare sent me to the GI.	EXPERIENCE
He changed med to Dipentum.	EXPERIENCE
Shortly after that I started aching inn my right elbow.	EXPERIENCE
It would come and go.	EXPERIENCE
This went on for 10 years.	EXPERIENCE
I did a lot of jogging.	EXPERIENCE
Seemed like the farther jogged my aches grew.	EXPERIENCE
Then the aches went to my shoulders.	EXPERIENCE
Sometimes my hips.	EXPERIENCE
The last flare started 2 years ago, and has just now getting under control.	EXPERIENCE
I tried Remicade, it seemed to be a wonder drug, for a month.	EXPERIENCE
It slowly became useless.	EXPERIENCE
I tried Humiria, it seemed to work fair.	EXPERIENCE
Finally I went back to Colazal.	EXPERIENCE
Taking 3 pills 3 times a day.	EXPERIENCE
Plus I am on Entocort.	EXPERIENCE
I am slowly getting better.	EXPERIENCE
My ""urgency"" to go it all but gone now.	EXPERIENCE
But during my 2 year flare, My joints did not hurt!	EXPERIENCE
Now that the flare is under control, I am starting to hurt again.	EXPERIENCE
I tried jogging 3 weeks ago and that really got my shoulders and elbows hurting.	EXPERIENCE
Apparently from the bouncing motion.	OPINION
Anyway It seems that there is an infection in me that is either in my colon or in my joints but not at the same time!	OPINION
I don't like taking Tylenol all the time.	OPINION
I take a half of a Lorcet when it really hurts.	EXPERIENCE
Anyway I just wanted to post ""my"" situation for anyone else who may have similar problems.	FACT
Hopefully ""if it doesn't kill us, it will make us stronger"".	OPINION
And please , anyone else reading these posts, do the rest of us a favor and post your ""problems"".	OPINION
Until I read about Colitis Arthritis, I thought I was NUTS!	OPINION
Wow I am so happy to read all these postings I was just notified that I was misdiagnosed and I never had Ulcerative Colits I have always had Chrons Disease.	EXPERIENCE
I am now addicted to Codeine Sulfate.	EXPERIENCE
I was given that to keep my bowels thicker.	EXPERIENCE
I have seen many GI doctors and I think they just love to write prescriptions to keep you quite.	OPINION
When I get down to pick something up it takes me forever to get back up my knees hurt so BAD.	EXPERIENCE
My arm and hand go numb and I have constant back pain.	EXPERIENCE
They think the back pain is from all the fistulas I now have.	EXPERIENCE
Before they diagnosed me with Chrons I was scheduled to go in for surgery on March 30th to make my ostomy bag forever.	EXPERIENCE
Now with me being diagnosed with Chrons not sure about the surgery but the dr still wants to do it.	EXPERIENCE
They now want to put me on all types of Chrons medicine.	EXPERIENCE
I am frustrated and so upset this has happened to me.	EXPERIENCE
Hi, I'm a 45 yr old woman who was diagnosed with Crohn's about 7 years ago but I definately had it for some time before that.	EXPERIENCE
I have also dealt with back pain for the last 20 years and have always dealt with it via chiro, acupuncture, massage, physio, swimming etc.	EXPERIENCE
but in the last 6 months I've had some episodes that have been the most painful of my life and have only recently been told that the two are likely related.	EXPERIENCE
I've been on Humira for 2 yrs, infliximab I reacted badly too, and colazide gives me diarhea, and the sulfasalizine type drugs just do bugger all.	EXPERIENCE
I want to only to say I empathise with you all.	FACT
To others we look like we're okay, it's hard for them to understand the excrutiating pain we can be in.	OPINION
And I'm relieved to discover there is a connection between the two.	OPINION
