text	factuality
I'm 33 just diagnosed 6 months ago with Crohns.So they put me on buspar and ultram.	EXPERIENCE
Well it caused me to have seizures.Well the best part is had back surgery 10 years ago.Go to the hospital messed up several discs and have damaged nerves.Now I have bursitis in my hip,caused by Crohns.I'm on so many meds,and.	EXPERIENCE
I think this is my life to I die.Im saying this because I have no one to talk to that really understands me.	EXPERIENCE
Anyone that really knows Crohns please email me at ***@****	FACT
Has any doctor thought of Fibromyalgia?	OPINION
Lyrica & Vitamin D3 seem to help me.	EXPERIENCE
Anyone out there changed their diet?	FACT
It worked wonders for me.	EXPERIENCE
I went to an herbalist who had me change my diet and also had me do a colon cleansing.	EXPERIENCE
I've been off of medication for over 6 years.	EXPERIENCE
Hi Christine, my bf is in the same situation, can i ask what medication your rheumatologist prescribed?	FACT
thanks for sharing.	NOT_LABELED
Stephanie.	NOT_LABELED
I am so sorry to read about everyone's pain.	OPINION
My sister in law was recently diagnosed with crohn's disease and she is having a lot of back pain.	EXPERIENCE
I was hoping to find some advice for her, but apparently you folks are just as desperate as she is.	OPINION
I wish you all relief from your pain.	OPINION
Hello, I was just diagnosed with Crohn's.	EXPERIENCE
They just put me on Pentasa 8 pills aday of 500mg each.	EXPERIENCE
Wow@@ The pain has not stopped, but hoping it will work.	EXPERIENCE
I do take Vicadon only when the pain causes me to cry and I can't move or sit or lie down, and sometimes it doesn't work.	EXPERIENCE
I have had MRI's to make sure it wasn't something else.	EXPERIENCE
Yes, all this pain comes from having Crohn's.	EXPERIENCE
I hope someday they will find something that would not kill of something else helping Crohn's.	OPINION
Also when things become so bad, I take a sleeping pill and muscle relaxer, that helps.	EXPERIENCE
It has change my life from this active, sport driven love to a person I do not know.	EXPERIENCE
Like another poster, I completely changed my diet & lifestyle.	EXPERIENCE
It has literally transformed me.	EXPERIENCE
Imuran, prednisone, humira, acsacol...	EXPERIENCE
Been on all of them.	EXPERIENCE
They only suppress the immune system & mask the problem, not the root of the problem: the SAD, toxins, pesticides, etc. poisoning our bodies for yeas.	OPINION
Caron's is not a disease, it is a symptom of poor health via poor nutritious and toxins over time.	FACT
You need to clean up the body to get well and stay well.	OPINION
I now eat all organic ( even when I cheat and have a cookie ( rare) it's organic) cut out sugar (most important), dairy, gluten, and processed foods.	EXPERIENCE
Am off SAD (standard American diet) and onto a paleo (anti-candida/anti-inflammatory) diet.	EXPERIENCE
THE RIGHT FOOD IS MEDICINE.	OPINION
So are the right fats (virgin cold-pressed coco it oil, cod, fish, primrose, flax oils) and ACV ( apple cider vinegar).	FACT
google all.	FACT
Also google Edgar Casey.	FACT
He knew this 100 years ago.	FACT
Great resource: www.healingnaturallybybee.com, and don't forget prayer.	OPINION
There is great power in prayer.	OPINION
God bless you all.	NOT_LABELED
i also only experience such terrible lower back pain just before a flare up, usually a terribly immobilizing cramping session.	EXPERIENCE
sometimes it has a cold feeling pressure, almost like the coldness associated with numbing, but it isnt numb at all, and has a stiff, sore feeling.	EXPERIENCE
The back pain almost makes me naucious...	EXPERIENCE
the crohn's cycle!	FACT
does anyone else experience this?	FACT
i am 18 and was diagnosed at 16.	EXPERIENCE
ive had symptoms since i was a very young child.	EXPERIENCE
i also only experience such terible lower back pain just before a flare up, usually a terribly immobilizing cramping session.	EXPERIENCE
sometimes it has a cold feeling pressure, almost like the coldness associated with numbing, but it isnt numb at all, and has a stiff, sore feeling.	EXPERIENCE
The back pain almost makes me naucious...	EXPERIENCE
the crohn's cycle!	FACT
does anyone else experience this?	FACT
i am 18 and was diagnosed at 16.	EXPERIENCE
ive had symptoms since i was a very young child.	EXPERIENCE
I feel so bad for you.	OPINION
I suffer with ulcerative Colitis for most of my life.	EXPERIENCE
I am 53 now and some times are better than others.	EXPERIENCE
I have flare ups and sometimes long remissions.	EXPERIENCE
I take asacol HD 3x day and enticort.	EXPERIENCE
It doesn't help a lot when the flare ups are at their worst.	EXPERIENCE
Don't ever give up although I do feel that way at times.	EXPERIENCE
That's when I realize the disease has taken control.	EXPERIENCE
It is up to us to take control and continue with life.	OPINION
I have 2 boys ages 12 and 15,along with 2 foster boys ages 4 and 7.	EXPERIENCE
They all need me and I need to be there for them.	OPINION
Medical technology has come so far and even there is no cure yet for our disease I keep the hope.	OPINION
It has been a while since your post and I hope you are doing better as I write this.	OPINION
To all of us suffering, PLEASE never give up.	OPINION
It will get better!	OPINION
I found what you have written interesting.	OPINION
I am a 28 year old male.	EXPERIENCE
I have been suffering from Crohn's for about 2 years .	EXPERIENCE
They tried every oral medicine out there nothing worked.	EXPERIENCE
Asacol is the only one I can name now.	EXPERIENCE
Then they brought the big dogs out and I started Remecade.	EXPERIENCE
The first go about I had no reaction.	EXPERIENCE
The second time though my blood pressure sky rocketed, as well as my heart rate.	EXPERIENCE
That was the last time for Remecade.	EXPERIENCE
After that I ended up being so bad I had emergency surgery for an abscess on my colon.	EXPERIENCE
I had reconstructive bowel surgery and had to wear an ileostomy bag for six months.	EXPERIENCE
The reversal went well.	EXPERIENCE
Felt good for a few months, then another flare up.	EXPERIENCE
Now I am starting Cimzia.	EXPERIENCE
I just took my first injection yesterday.	EXPERIENCE
I really want to change my entire diet.	OPINION
I have been reading a lot about SCD.	FACT
Simple Carbohydrate diet.	FACT
Should I keep taking the medication and change my diet at the same time?	OPINION
I am really confused.	OPINION
just wanted some advice .	FACT
thank you.	NOT_LABELED
Can you share what med that was that helped you?	FACT
I was diagnosed with Crohns 5 years ago.	EXPERIENCE
After high dosage of prednisone and infusions it went away.	EXPERIENCE
I thoguht I was home free but 5 years later its back with avengence.	EXPERIENCE
Nothing is working.	EXPERIENCE
This time its really bad and I feel scared.	EXPERIENCE
Doc tells me our next step is remicade, humira etc.	EXPERIENCE
After researching I dont feel comfortable with trying any of those.	OPINION
It seems that it may help with the crohns but start a whole new diesease to tackle.	OPINION
My husbands co-worker suggested that I should try aloe vera juice.	OPINION
So I picked up some two days ago.	EXPERIENCE
Have been drinking 6 ounces daily since.	EXPERIENCE
I feel something is happening....stomach feels quiet.	EXPERIENCE
Although I still have the runs but not as much.	EXPERIENCE
I hope this is the start of a miracle!!	OPINION
If this helps.....Im planting aloe vera all over my yard!!!!! Since I have been there and know what it is like to go through life with crohns and other realted issues, I would like to give a cyber hug to all who are going through this.	OPINION
Breath through the pain and stay positive.	OPINION
Keep researching and dont be shy to vent.	OPINION
Sometimes help comes from the least expected source!	OPINION
Love You All!!!	NOT_LABELED
My brother-in-law has Crohn's and a gluten free diet made him 90% better.	EXPERIENCE
Unlike you, he suffers from it all the time.	EXPERIENCE
Maybe something for you to try.	OPINION
Hi, My name is bridget.	NOT_LABELED
I am 25 years old and have Ulcerative colitus of course Crohn's is its cousin they are so alike.	EXPERIENCE
Let me tell you you are in the right step of healing process ALOE VERA?	OPINION
I have herd good things about it.	OPINION
it helps ease pain bloating, bleeding inflammation in the rectum.	FACT
Its a natural medicine sent frm god.	OPINION
I truly beleive in natural remedies cause Im sick of medicine like asacol, Colazol, predisone they just worsen your symptoms.	OPINION
I have been off them for 1 years now and use natural herb remedies like aloe vera frm forever living also fenugreek and organic probiotics.	EXPERIENCE
Fenugreek is a natural herb plant frm india that helps with gastrointestinal disorders I drink that everyday before foods early morenings.	FACT
I discovered it through a Chinese doctor that studied natural medicine and herbs frm china for many years.	FACT
Let me say that I feel great they are miracle workers..	OPINION
The best of luck to you.	OPINION
The start of a miracle will end up a miracle!	NOT_LABELED
Thank you for the reply.	NOT_LABELED
I'm willing to try anything which is not toxic to my health.	OPINION
I have heard about gluten free diet.	FACT
Maybe I will go ahead and try it along with aloe vera juice.	OPINION
Thanks :)	NOT_LABELED
Thank you for the reply.	NOT_LABELED
I'm so happy for you!	OPINION
I cant wait to feel better again soon!	OPINION
Aloe vera has made me 60% better in one week.	EXPERIENCE
It has cut down my bathroom visits to half.	EXPERIENCE
The pain has calmed down a little.	EXPERIENCE
After this Im headed out to find me some gluten free eats and fenugreek.	EXPERIENCE
I appreciate your help and support :) Thanks!	OPINION
Went shopping over the weekend and found this herbal tea.	EXPERIENCE
Its called Mothers milk.	FACT
Its made with fenugreek seeds!	FACT
Although I felt wierd buying something which is for healthy lactation(since Im not nursing), I want to get the other benefits from fenugreek seeds.	OPINION
Straight up fenugreek tea was too bitter but this one is little mild and Im able to consume it better.	EXPERIENCE
Im still continuing the aloe vera regimen.	EXPERIENCE
It has helped a great deal and I hope this tea will help finish the job.	EXPERIENCE
Staying hopeful :)	OPINION
Hi guys.	NOT_LABELED
I was diagnosed with ulcerative colitis last year and im having a terrible time of it at the moment.	EXPERIENCE
Steroids worked but doctors have taken me off them as they say i am too young to go on them full time.	EXPERIENCE
I am 32.	FACT
I have heard lots of good things about aloe vera.	EXPERIENCE
Should i buy an aloe vera drink or capsules?	OPINION
Many thanks.	NOT_LABELED
Charlotte.	NOT_LABELED
hey- I was diagnosed with UC 2 years ago, and I have been on steroids almost just as long.	EXPERIENCE
I am younger than you are, now 25, but started them when I was 23.	EXPERIENCE
If the steriods work I would stay on them until you get your UC under control.	OPINION
At one point I used aloe vera, and it just made things worse.	EXPERIENCE
I told me dr I was taking it and she said that it causes you to go to the bathroom, that is how it ""cleanses"" your body.	EXPERIENCE
So i stopped it.	EXPERIENCE
There are other medications out there for UC, have you tried 6MP or Imuran, they are pills?	EXPERIENCE
Personally, it had side effects, but everyone else I have talked to, or read about, especially on this site, has had amazing results with it.	EXPERIENCE
If you are not on steriods right now, it would be a good time to try it so you would not have to be taken off of them again.	OPINION
Other medications that I have heard that have worked well for other people are Humiera and Remicade.	FACT
The last to are a self injection, and an infusion, respectively.	FACT
Hey Cheekecharlie!	NOT_LABELED
I have been taking aloe vera juice.	EXPERIENCE
I have heard about the capsules but havent tried them.	EXPERIENCE
I was thinking to get some but the juice has completely turned my life around in a month!	EXPERIENCE
Im all better and feel great at this point.	EXPERIENCE
If you are taking any mesalmine (Lialda etc) tablets....I would suggest you keep taking them too.	OPINION
I drink the juice first thing in the morning and with dinner and one small dose right before bed.	EXPERIENCE
About 3 ounces at AM and 3 ounces with dinner and 2 ounces before bed.	EXPERIENCE
Good luck!	NOT_LABELED
I been dx with crohns disease but I won't take any medication because I feel great drinking aloe vera every morning just blend with honey and lemon you will see is a miracle...	EXPERIENCE
I've been taking AMP (Aloe Muciaginous Polysaccarides) for ten months.	EXPERIENCE
I have had incredible success in gaining remission from crohn's.	EXPERIENCE
I now lead a normal life free of the hell crohn's put me through.	EXPERIENCE
Great not to have the awful side affects of steroids,methotrexate,6mp.	OPINION
AMP is the healing molecules which is extracted from Aloe(my understanding).	FACT
I came across it on you tube when i viewed a testimonial by a girl in the US (Jennifer) & a guy in the UK (keith).	EXPERIENCE
It wasn't cheap when i started but i now take 3 capsules p/d its reasonable.	EXPERIENCE
ALL OF YOU STAY AWAY FROM THE ALOE VERA ESPECIALLY ANYONE ALLERGIC TO LATEX!!	OPINION
Latex: The most serious difficulties encountered with aloe latex occur at higher than recommended doses or when used for more than a few days.	FACT
This laxative herb causes the loss of potassium and other minerals, which over time can result in a loss of muscle tone of the intestine and diminished effectiveness.	FACT
Frequent use may cause irreversible damage.	FACT
Large doses of aloe have caused bloody diarrhea, kidney damage, and even death.	FACT
The urine may take on a reddish color after taking aloe latex.	FACT
This color is harmless; however, with the possibility of kidney damage from large doses or prolonged use, any persistent color in the urine may call for medical diagnosis.	FACT
Aloe gel is LIKELY SAFE when applied to the skin and POSSIBLY SAFE when taken by mouth in adults.	FACT
Once in a while aloe gel might cause burning and itching of the skin.	FACT
Taking aloe latex is POSSIBLY UNSAFE at any dose, but LIKELY UNSAFE when taken in high doses.	FACT
Aloe latex can cause some side effects such as stomach pain and cramps.	FACT
Long-term use of large amounts of aloe latex might cause diarrhea, kidney problems, blood in the urine, low potassium, muscle weakness, weight loss, and heart disturbances.	FACT
Taking aloe latex 1 gram per day for several days can be fatal.	FACT
There have been a few reports of liver problems in some people who have taken an aloe leaf extract; however, this is uncommon.	FACT
It is thought to only occur in people who are extra sensitive (hypersensitive) to aloe.	FACT
Special Precautions & Warnings: Pregnancy or breast-feeding: Aloe -- either gel or latex -- is POSSIBLY UNSAFE when taken by mouth.	FACT
There is a report that aloe was associated with miscarriage.	FACT
It could also be a risk for birth defects.	FACT
Do not take aloe by mouth if you are pregnant or breast-feeding.	FACT
Children: Aloe is POSSIBLY UNSAFE for children when taken by mouth.	FACT
Children younger than 12 years old may experience abdominal pain, cramps, and diarrhea.	FACT
Diabetes: Some research suggests aloe might lower blood sugar.	FACT
If you take aloe by mouth and you have diabetes, monitor your blood sugar levels closely.	FACT
Intestinal conditions such as Crohn's disease, ulcerative colitis, or obstruction: Do not take aloe latex if you have any of these conditions.	FACT
Aloe latex is a bowel irritant.	FACT
Remember, products made from whole aloe leaves will contain some aloe latex.	FACT
Hemorrhoids: Do not take aloe latex if you have hemorrhoids.	FACT
It could make the condition worse.	FACT
Remember, products made from whole aloe leaves will contain some aloe latex.	FACT
Kidney problems: High doses of aloe latex have been linked to kidney failure and other serious conditions.	FACT
Surgery: Aloe might affect blood sugar levels and could interfere with blood sugar control during and after surgery.	FACT
Stop taking aloe at least 2 weeks before a scheduled surgery.	FACT
Applying aloe vera gel is considered safe, but consuming unprocessed juice extracted from the latex can cause several side effects leading to major health risks.	FACT
Some of the side effects of aloe vera juice are:	FACT
1. Aloe vera juice contains a substance called anthraquinone, a laxative, which can cause diarrhea if taken in large amounts.	FACT
Severe diarrhea can cause pain, cramps and dehydration.	FACT
2.Consult your doctor before consuming aloe vera juice, especially if you’re undergoing a medical treatment or taking prescribed drugs, as the juice may cause adverse reactions when consumed along with few medicines.	FACT
Laxative in aloe vera may even inhibit the absorption of some drugs in the body.	FACT
Aloe vera juice also reacts to herbs like jalap roots, castor oil, rhubarb root and bark root, causing dehydration and diarrhea.	FACT
Fenugreek and garlic do not digest well with aloe juice; it can lower blood sugar and potassium levels in the body.	FACT
3. Drinking aloe vera juice can result in allergic reactions like skin rash or hives, itchy or swollen skin, difficulty in breathing, chest pain and throat irritation.	FACT
4. Aloe vera juice contains latex, an ingredient which has many health risks associated with it.	FACT
It can aggravate health problems like colitis, Crohn’s disease, appendicitis, diverticulosis, intestinal obstruction, hemorrhoid, stomach pains and ulcers.	FACT
There are also reports which suggest of hepatitis caused by consumption of aloe vera juice, becoming a cause of concern for people with liver problems.	FACT
5. Pregnant and lactating women are strictly forbidden from consuming aloe vera juice, due to its purgative and irritant qualities.	FACT
It may stimulate uterine contractions in pregnant women, leading to miscarriage and birth defects.	FACT
Lactating women should also refrain from consuming aloe vera juice, as it contains anthraquinone which may lead to diarrhea.	OPINION
It is also considered unsafe for children below 12 years of age.	FACT
6. People, who suffer from irritable bowel syndrome and gastrointestinal problem, should not drink aloe vera juice, as it contains high amount of laxatives which can increase the severity of the problem.	OPINION
7. Drinking unprocessed aloe vera juice can cause dehydration and electrolyte imbalance in the body.	FACT
It also changes urine color to pink or red in color.	FACT
8. Consumption of aloe vera juice can lead the body to produce excessive amounts of adrenaline, which can be harmful for people suffering from heart conditions.	FACT
It can also lower potassium levels in the body, causing irregular heartbeats, weakness and soft muscles.	FACT
Hence, it is not recommended for children and elderly people.	FACT
9. Consuming aloe vera juice, for more than a year can cause pseudomelanosis coli, a condition which increases the risk of colorectal cancer.	FACT
There are even possibilities of developing carcinogenic risk if consumed in high amounts.	FACT
10. Aloe vera juice helps to lower blood sugar levels by decreasing insulin resistance in the body.10,	FACT
Thus, people who are undergoing treatment for hypoglycemia or diabetes should consult their physician before consuming aloe vera juice.	OPINION
11. Overdose of aloe vera juice can cause blood build-up in the pelvis, which leads to kidney damage.	FACT
12. Prolonged usage of aloe vera juice can increase the risk of constipation.	FACT
Also, intake of aloe latex can cause depletion of the potassium from the cells of the intestinal lining.	FACT
I too have Crohn's Disease.	EXPERIENCE
I've had it for 16 years.	EXPERIENCE
I went from the mildest case my Gastroenterologist has ever seen to, in his words, become his problem child.	EXPERIENCE
I have been on all the pills including Entocort with a daily Folic Acid.	EXPERIENCE
Crohn's affects everyone differently so the treatments do as well.	FACT
Unfortunately the treatments only work for a finite amount of time.	FACT
Your body will start to resist them.	FACT
Do your research.	OPINION
Talk to your Gastroenterologist.	OPINION
If you aren't being managed by one I strongly suggest going to see one.	OPINION
I have been on most of the biologics such as, Humira, Cimzia, Remicade.	EXPERIENCE
They do lower your immune system so you need to avoid people who are sick.	FACT
There are side affects but they are minimal compared to the side affects of Crohn's.	FACT
The best advice I could give is to watch what you eat, make a good diary of what you eat and when and how it makes you feel, also include how it affects your bowel movements.	OPINION
Write down if they are loose or hard, watery, what color it is, if there is an unusually foul smell, or if you notice any blood.	OPINION
Share this information with your doctor.	OPINION
Talk to a nutritionist to help with planning meals to get your vitamins.	OPINION
Hard thing to do when a person has Crohn's.	OPINION
Try to stay regular when it comes to your bowel movements.	OPINION
The more fibrous the food is will cause pain and constipation.	FACT
Try to avoid nuts, fresh fruit and vegetables, whole grains and dairy since lactose intolerance goes hand in hand with Crohn's.	OPINION
Don't let people convince you to try the latest fads around colon cleansing and probiotics.	OPINION
Always consult your doctor first and I can't stress this enough do your research.	OPINION
Get your rest.	OPINION
Drink lots of water.	OPINION
Limit anything with caffeine.	OPINION
Join a support group.	OPINION
If there aren't any in your area there are several groups on Facebook.	FACT
Tell them what you deal with.	OPINION
They, like me, will gladly try to help you.	FACT
We've all been there.	FACT
We don't want to see others make mistakes if we can help it.	FACT
Crohn's does not have a cure.	FACT
It can and will come back.	FACT
The best we can pray for us to be in remission and symptom free.	OPINION
This is a disease you must be mindful of for the rest of your life.	OPINION
Left untreated it will get worse.	FACT
Take care and good luck.	NOT_LABELED
If you want to talk to me or ask me questions I am on Facebook as Lori Spurgeon from Ottumwa, Iowa.	FACT
Just send me a message to remind me it's you so I will make sure to add you on my friends list.	FACT
The core of the problem is autoimmune, our immune keep atacking our body causes Ulcerative colitis or Crohn.	FACT
I got UC.	EXPERIENCE
Before my immune attacked knees joint, ankylosing spondilitis.	EXPERIENCE
I went to doctor but seems helpless because they kept trying to heal my joint.	EXPERIENCE
The problem is the auto immune.	FACT
It happened 10 years ago.	EXPERIENCE
Until I found mangosteen skin juice named xamthone (indonesia is my country) it helped a lot to control my immune and my joint healed by itself.	EXPERIENCE
I back to normal life and skip drinking xamthone mangosteen skin juice.	EXPERIENCE
3 months ago I got hemorrhoid and fistula, hurt so bad!	EXPERIENCE
I went to doctor and he heal me with 9 injection everyweek to my hemorrhoid and fistula, but he found there are puses in my colon and giving me antibiotics levaquin for 7 days if pus isnt gone yet he asked me to do endoscopy.	EXPERIENCE
Im so afraid what happened to me since I felt better after my hemorrhoid cure.	EXPERIENCE
Then I start search the internet and found that I got ulcerative colitis caused by auto immune.	EXPERIENCE
I start to drink that mangosteen juice anymore and feel better.	EXPERIENCE
Autoimmune causes UC, UC causes hemorrhoid and fistula.	FACT
Before i. Autoimmune causes joint disease ankilosing spondilitis.	FACT
So we need to control our immune and mangosteen skin juice help me (God Jesus showed me) I searched a lot and found that cabbage also helped.	OPINION
Some aloevera helped too..	OPINION
Control the autoimmune first!	OPINION
Go chek the diseases that caused by autoimmune.	OPINION
Hope it helps, Indonesia.	NOT_LABELED
For the past month now, I have had chronic diarreah.	EXPERIENCE
Everything I eat, gives me diarreah.	EXPERIENCE
It is extremely painfull.	FACT
I get cramps that radiate into my legs and down to my feet.	EXPERIENCE
I am litterally screaming in pain, in the bathroom.	EXPERIENCE
I have had this problem since I was a kid, and it seems to have gotten worse recently.	EXPERIENCE
I can't eat anything without getting bad cramps and diarreah.	EXPERIENCE
I have to drink half a bottle of pepto bismol, to keep myself from spending hours in the bathroom.	EXPERIENCE
When the Pepto wears off, I will get woken up at 7:30 am, with bad gas and cramping.	EXPERIENCE
Then the diarreah will start up again.	EXPERIENCE
It will hurt really bad, and then I'll have a movement.	EXPERIENCE
Then I feel ok, and then a minute later, the pain and another small movement comes.	EXPERIENCE
I now have a dull aching that shows up in my feet, right before the cramps and bowel movements start.	EXPERIENCE
The pain gets worse right before I have the movement.	EXPERIENCE
I can't take it anymore!	OPINION
This diarreah is controlling my life and making it very hard to do normal every day things.	EXPERIENCE
I'm stuck at home sometimes cuz I can't stop going to the bathroom.	EXPERIENCE
The pain is excruciating and nothing seems to make it go away.	EXPERIENCE
I take immodiums, but they're expensive and when they wear off, I feel like I wanna die.	EXPERIENCE
I have been to doctors for this same problem, minus the foot pain, and they give me the same line of bull.	EXPERIENCE
It's stress.	EXPERIENCE
It's not stress!	EXPERIENCE
I have nothing to be stressed out about!	EXPERIENCE
My life is pretty peacefull.	EXPERIENCE
I'm desparate for answers and some kind of relief.	EXPERIENCE
I'm hoping someone can help me out here.	OPINION
I've tried telling my friends and they tell me I'm insane an that it's all in my head.	EXPERIENCE
