text	factuality
hi, my doctor has come to the conclusion i have IBS after not showing any signs of chrons in a colonoscopy test .	EXPERIENCE
I have every symptom of chrons however: Ab pain, bowel changes, bloating, pain, have had red eyes, sore on leg that change colour when fading, mouth ulcers, etc	EXPERIENCE
my question is has anyone been diagnosed with chrons after having a clear colonoscpy?	FACT
Sorry ma'am but I was diagnosed with it after my bloodwork, colonoscopy and biopsies came back positive.	EXPERIENCE
Most people I have talked to that have Chrons also had the positive colonoscopy's which sealed the deal.	EXPERIENCE
Sorry.	NOT_LABELED
It is possible you have Crohn's in the small intestine, which will not show on a colonoscopy, as this only looks at the large intestine (colon).	OPINION
An upper endoscopy (to look at the oesophagus, stomach and small intestine) is another test to rule out Crohn's as biopsies can be taken of the tissue during the procedure.	FACT
Crohn's often starts around the terminal ileum (next to the appendix) and can progress to the whole GI tract (mouth to anus), as mine has done.	EXPERIENCE
A barium swallow through is another test to see any problems in the upper GI tract, but this is purely imaging, and biopsies cannot not be taken.	FACT
As far as I understand, the only conclusive proof of Crohn's is biopsy of affected tissue, looked at by a pathologist.	OPINION
IBS is a diagnosis of exclusion - after all available tests are completed and found negative for Crohn's or Ulcerative Colitis.	FACT
It is not an IBD auto-immune disease and in my opinion, a lazy diagnosis by doctors who cannot be bothered to do proper evaluations.	OPINION
Have you been tested for coeliac disease, as this can have similar symptoms to IBD?	FACT
Liz.	NOT_LABELED
I had something simular happen.	EXPERIENCE
I had surgery in August to remove a mass in my small intestine, in the terminal ileum and they biopsy said high probability of Crohns.	EXPERIENCE
However, when I had a colonoscopy and endoscopy 5 months later, it showed inflamation.	EXPERIENCE
and ulcers throughout my small intestine but this time negative on the Crohns.	EXPERIENCE
I don't really understand.	OPINION
The doctor said I could still have it but been in remission during that time.	EXPERIENCE
That makes no sense to me.	OPINION
So we still don't know if I have it or not.	FACT
I've had biopsy that said yes and one that said no, I guess.	EXPERIENCE
It just doesn't make sense to me.	OPINION
Still, the prescription is the same whether I have it or not, steriods to clear up the ulcers and inflamation.	FACT
I'm taking Entocort and Nexium.	FACT
The doctor told me as long as I'm still feeling pretty good by this Summer then won't need to see him again unless I get symptoms again.	FACT
He told me that doctor's are reluctant to diagnose Crohns unless they know definately it is Crohns because of insurance reasons.	FACT
I guess I can understand that.	OPINION
Still, I'd like to know if I have Crohns or if it's something else, what is it?	OPINION
You know?	NOT_LABELED
I hope you get a diagnosis soon.	OPINION
I can understand your frustration.	OPINION
I wish you well.	NOT_LABELED
Take care.	NOT_LABELED
thankyou both for your informative replies...	NOT_LABELED
I have heard of people who have chrons in the small intestines ...	EXPERIENCE
however when i asked my doctor whether or not this could be a possibility, he said if i had chrons it more than likely would have shown up in the bowel/colon and didnt want to talk any further.	EXPERIENCE
i feel very frustrated as i have looked into many chrons symptoms from people with chrons and have been through everything they have ..	EXPERIENCE
i was overwhelmed to finally find someone else going through what i have...	NOT_LABELED
i share your opinion of IBS being a lazy diognosis from a doctor ...	OPINION
i just dont think you can be as sick as i've been and it be that...	OPINION
and do you have to be having an attack of chrons for the colonoscopy/ endoscopy to pick up a positive result ...	FACT
or can it be picked up when youre not showing any symptoms?	FACT
....sounds like Aprils question!	NOT_LABELED
anyway ,isn't it just great when you get better..	OPINION
have had 5 weeks of hell and am now feeling normal again!	EXPERIENCE
how are you girls feeling ?	NOT_LABELED
good to talk...	NOT_LABELED
thanks for listening, ....saradan.	NOT_LABELED
( steph)	NOT_LABELED
Ok I know I said it wrong, but for the last 2 woman who posted, I was reading that there are 5 different Crohns, not sure of all but remember the most common was the ilieum, then lg intestines, then beggining of sm.	FACT
intestines the duednum, from mouth to anus.	FACT
and in some the jejelum,(where they can see with the endo capsule camera, but not with regular endoscope or colonoscope??	FACT
I was wondering abt this myself??	NOT_LABELED
Any responses at the jejelum would be appreciated.	OPINION
Thanx,georgie.	NOT_LABELED
You can have Crohn's Disease anywhere in your digestive tract, from your lips to your anus.	FACT
It is most common in the colon, but it isn't exclusive.	FACT
Think of it as a mean thing living inside of you that can either attack one place or spread to another place, or MOVE to another.	FACT
This is why patients who have portions of their bowel removed, sometimes have Crohn's pop up in a new part.	FACT
I would recommend getting a capsule endoscopy.	OPINION
You swollow a camera in a pill that sends photos every three seconds to a machine that you wear around your stomach for the day.	FACT
It does not hurt at all and it eventually comes out naturally like anything else.	FACT
trust me ,when a doctor does a colonoscopy,he goes into the small intestines, most people with crohns has it in the iliuem.i got dignosed with crohns disease in the year 2000,.	OPINION
and just last year got dignosed with ulcerative colitis and diverticulis.just got out of hospital in time to celebrate christmas,was in hospital 7 times last year with it not fun.if you feel you need a second oppion get one.	EXPERIENCE
crohns can even affect the eyes.	FACT
my eyes look like there bleeding,my tongue has ulcers it goes all the way to my abdmion,mostly right side but affects left side and my back.kidneys are being affected.im going to the cleveland clinic for my crohns now.this is not a disease i wish uppon anyone, both of you sound like you need a second oppion.	EXPERIENCE
I am in a similar situation and trying to get a second opinion at this point.	EXPERIENCE
I have been having intestinal problems since 2002 and just a year ago got a dr to finally find a colonoscopy necessary.	EXPERIENCE
I was diagnosed from that with non specific non ulcerative colitis.	EXPERIENCE
I suffer daily with mucousy diarhea, and abdominal cramping and pain.	EXPERIENCE
Recently I develped a peri rectal abcess and fistula that I am seeing a colorectal surgeon for, who informed me that I had been misdiagnosed by the first GI dr because the only two conditions that can cause that kind of fistula is crohns or ulcerative colitis.	EXPERIENCE
I have only been treated for the currest symptoms with hyoscamine and another med but I can't remember what it was offhand...started with an L i think but I couldn't handle the side effects from it.	EXPERIENCE
I am not getting much relief from the medications that I have been given.	EXPERIENCE
I am also being treated by my general dr for anxiety and depression disorder and for chronic insomnia.	EXPERIENCE
I really just think there is something much deeper going on here with all these different things going on.	OPINION
Anyone have any ideas or suggestions?	NOT_LABELED
I went undiagnosed for 12 years with Chrons.	EXPERIENCE
I was always told I had IBS but I knew different I was too sick for that.	EXPERIENCE
Through a colonoscopy there was some inflammation but they still did got get me a diagnoses (5 Colonoscopies later).	EXPERIENCE
It was not until my dr ran a specific blood test for Chrons that came back abnormal was I finally diagnosed with Chrons.	EXPERIENCE
Be very insistent, we know our bodies better than any dr out there.	OPINION
If you know something is wrong keep pursuing it.	OPINION
IBS not not include any inflammation internally and a fever and such.	FACT
Hope nobody ever has to wait as long as I did for help and treatment.	EXPERIENCE
Ask your doctor for a SED rate and CRP blood test.	OPINION
Ask for a genetic test to be done on your blood.	OPINION
It's expensive but conclusive.	FACT
Crohn's doesn't always show up in a colonoscopy.	FACT
Depends upon where it is located and that can change.	FACT
Prednisone is not for long-term therapy.	FACT
It destroys your teeth, muscles, tissues that can result in hip and shoulder replacements.	FACT
The disease ***** but you can control it with a positive attitude, healthy diet and proper medical care.	OPINION
I keep having rectal bleeding even though I use HC suppositories which help.	EXPERIENCE
My colonoscopy and endoscopy came back negative for Crohn's.	EXPERIENCE
Which blood tests do I need done to be sure?	FACT
I'm on prednisone 10mg/day for one month for my asthma and need it to breathe better and relax.	EXPERIENCE
I am in a similar position too...	EXPERIENCE
my problems started around two in a half years ago where i had extreme pain after eating any types of foods, followed by diarrhoea...	EXPERIENCE
sometimes the pain was everyday, sometimes once a week but whenever it was it was so painful i would almost faint and could barely walk..	EXPERIENCE
I started loosing weight, ive lost about 10kg since the pain first started.	EXPERIENCE
My pains only come about once every 2months now because i am careful with the amounts i eat and how much of certain foods i can eat, i have learnt to read my stomach and when i need to stop eating in order to stop the pain from coming.	EXPERIENCE
I have lost my appetite and i rarely feel hungry.	EXPERIENCE
Nearly every day i feel nauseous.	EXPERIENCE
On the days i dont have diarrheoa i tend to be constipated, sometimes i dont go for days.	EXPERIENCE
My stomach swells very easily too, half the time i look pregnant and i am a petite person.	EXPERIENCE
I have been to a gastrologist for my problem and had tests upon tests.	EXPERIENCE
I have had a colonscopy, endoscopy, blood tests, urine tests, stool tests and an xray and the only thing the doctor has found is that i am lactose intolerant which is far from the only problem i believe i have because even when i went on a lactose free diet for a month i was still experiencing the same problems, and now i pretty much eat lactose free butter, cheese, milk and yogurt.	EXPERIENCE
Recently i also bleed from my bottom and skin came out from somewhere inside.	EXPERIENCE
For a week after that i had mucus in my stool and now i keep getting anal fissures.	EXPERIENCE
Has anyone else had a similar problem?	NOT_LABELED
Can you still have Crohn's if your IBD blood work came back normal?	FACT
A CT revealed thickening between my intestine and bowel.	EXPERIENCE
The stomach pain gets me down so bad I can't function.	EXPERIENCE
I have felt pretty good the last few weeks with just mild cramping and diahrea.	EXPERIENCE
I have major joint pain and fatigue most of the time.	EXPERIENCE
The nausea is very bad at times also.	EXPERIENCE
I am an active person and these symptoms have slowed me down a lot.	EXPERIENCE
I am scheduled for an upper and lower GI next Wednesday...	EXPERIENCE
Any advice....:	NOT_LABELED
Hi I'm only 17 yrs old and I have been suffering with all the symptoms of chrones disease for three months straight now.	EXPERIENCE
my aunty has chrones disease very bad also.	EXPERIENCE
I've had numerous blood tests, urine samples, stool samples, an endoscopy, colonoscopy, MRI scan and EVERYTHING came back normal.	EXPERIENCE
Obviously its so frustrating and now they're putting it down to IBS.	EXPERIENCE
Like you say, you know your own body better than anybody and it upsets me because I know it is something far more serious than that.	OPINION
I've had lots of blood and mucus in my stools for four months without fail.	EXPERIENCE
I've lost half a stone (and I am only 7 stone as it is) I sleep for days straight, I won't eat for days and the pain is unbearable the doctors prescribed me lots of codeine.	EXPERIENCE
It gets me down that the doctors are leaving it to IBS because I know this is not the case.	OPINION
It's horrible to think I may go 12 years living like this - it really puts a hold on reality :( thanks for all this advice it makes me feel better that theres people out there in the same position as me.	OPINION
Ive been suffering for 2 years.	EXPERIENCE
Ive had blood work, stool tests, endoscopy and colonoscopy all came back negative.	EXPERIENCE
My colonoscopy showed apthous ulcers in my descending colon but the biopsies came back normal.	EXPERIENCE
My dr said it would be unusual for crohns to be in that part of my intestines.	EXPERIENCE
She said its usually in the small intestine.	EXPERIENCE
I suffer pretty much everyday with colon pain and just a feeling of complete unwellness.	EXPERIENCE
On the days I dont have a bowel movement I feel great but it seems like when I do have one, my whole body feels sick.	EXPERIENCE
I also have loss of appetite at times adn some weight loss.	EXPERIENCE
My dr also told me that crohns is usually just diarrhea.	EXPERIENCE
My stool is usually normal but it still makes me feel sick.	EXPERIENCE
Can anyone tell me if this sounds like Crohns?	NOT_LABELED
She thinks I have IBS but wants to do another colonoscopy to rule out crohns for sure.	EXPERIENCE
Thanks for any help you can give me .	NOT_LABELED
My dr. just diagnosis me with crohns	EXPERIENCE
I do not belive that this is my problem.	OPINION
I have no signs of symptoms of crohns.	EXPERIENCE
My sister, brother and son all have crohns so I know what to look for.	EXPERIENCE
He did a colonoscopy and a scope down the throat( done on the same day).	EXPERIENCE
The doc. said everything was clear but he said he thought he seen an infection so he did 3 biops.	EXPERIENCE
now he tells me that it is crohns and not my GB even though ny GB is only working at 8% from a hida scan.	EXPERIENCE
I still don't belive I have crohns but i don't know where to go from here.	OPINION
He wants me to start on meds for crohns and I am not ready to do this.	OPINION
I need more proof.	OPINION
Well, the most common area for Crohn's disease to first strike is the terminal ileum which would be in the lower right quadrant.	FACT
HOWEVER, Crohn's colitis is not at all uncommon (not the same thing as Ulcerative colitis) AND Crohn's disease can strike ANYWHERE in the GI tract from mouth to anus so ....	FACT
Crohn's disease is a very individualistic disease.	FACT
Most crohnies do enounter diarrhea, but there are plenty of use who encounter constipation.	FACT
My gastro likes to do colonoscopies too.	FACT
My Crohn's struck first in the mid-ileum and there hasn't been involvement near the ileocecal valve.	EXPERIENCE
So WHY would I put myself thru that hor-eye-bull prep for a colonoscopy???	OPINION
IF a barium upper GI and SBFT doesn't give any answers, there is the CT Enterography, the MR Enterography and the Pill Camera Endoscopy.	FACT
I forgot: there is also the double balloon endoscopy (they get you from both ends and mark in the middle).	FACT
My fourteen year old has bad stabbing stomach pain to the right, below and above the belly button.	EXPERIENCE
He had his appendix removed three months ago and they found imflamation around his ilium after colonoscopy they found several ulcers in his duedenal bulb.	EXPERIENCE
The consult said it wasn't crohns after doing two enoscopy examinations and one colonoscopy.	EXPERIENCE
He is not gaining weight, is finding alot of food makes the pain worse and gets very constipated - anyone have any ideas?	EXPERIENCE
Angela.	NOT_LABELED
I feel bad for everyone that has to deal with this disease i have, ""Ulcerative Colitis""..	OPINION
On 9-25-2012 at Memorial Hospital of Tampa i had asked my Doctor HJW is the difference between Ulcerative & Crohns Disease play a wider part in my case as to complications i may have as a result of a positive outcome on tests for Crohns (biopsy).	EXPERIENCE
No sooner did i finish my question to him, did he say ""I'm not going to stand here and have you give me a F*****G course on anatomy and stormed out of my room.	EXPERIENCE
So much for the ""patients Bill of Rights"" and or ""Civil Rights"".	OPINION
I have since filed a Formal Complaint to the C.E.O., AHCA, Florida Department of Health Consumer Services Unit, Department of Civil Rights (OCR), Division of Quality Care, Office of the Chief Inspector General ect.	FACT
Next will be the Media.	FACT
They have stripped me of my self Dignity knowing full well that stress is already at it's peek level.Total Disregard for a human being under their care.	OPINION
Hopefully some one with Administrative Power will have some morals to correct this nightmare he has inflicted upon me.	OPINION
So much for private health care.	OPINION
Anthem Blue Cross Blue Shield has turned a blind eye to this situation through informal complaint, but thats fixing to change through a formal complaint to their Medical Director.	FACT
Dr. HJW is accredited through them shame on them.	FACT
its a damn shame one should have to feel intimidated to further their care to recovery through the ones that treated you in the first place.	OPINION
A speedy recovery to all above and beyond.	OPINION
J.C.	NOT_LABELED
I've been going through the whole diagnosis process for Chron's.	EXPERIENCE
The colonoscopy didn't show signs of it, but I had a polyp that he removed, and he took samples in my lg intestine for biopsy.	EXPERIENCE
If they didn't see it on the screen during the actual colonoscopy, can it still show up in the biopsies?	FACT
I have so many symptoms.	EXPERIENCE
Abd pain, frequent bowel movements, feeling like I still have to go diarrhea, but nothing comes out and it hurts so bad.	EXPERIENCE
I typically have about 6 BM's a day.	EXPERIENCE
I have white discharge from my rectum, joint pain (knees, wrist), pain so bad that I have to take percocet and lay in bed in the fetal position.	EXPERIENCE
I know something more serious than ibs is going on with me.	OPINION
I've been so sick for about 4 months now.	EXPERIENCE
I will get results from colonoscopy biopsies next week.	FACT
I pray they figure out what's going on with me!	OPINION
I am experiencing the same thing!	EXPERIENCE
Lost 20 pounds in less than a month and couldn't get out of bed for two.	EXPERIENCE
My stomach hurts when it's empty but hurts more when I try to eat and I have to take a change of clothes with me everywhere I go because taking 2 plus Imodium.	EXPERIENCE
doesn't help!	OPINION
Have received negative results for Chron's, Addison's, Celiac and more so I must be OK, right?	EXPERIENCE
Have a new Doc who thinks it might be Inflammatory Bowel Disease.	EXPERIENCE
Have to have an abdominal CT scan and more blood work.	EXPERIENCE
Tired of taking pain pills but I'm also tired of being in pain.	EXPERIENCE
If ANYONE has ideas, please help!	NOT_LABELED
I too am going through this for the past 4 years I have been having episodes of bloating, runs, pain in left side, night sweats and feel so unwell.	EXPERIENCE
I get these large boils in my groin everytime my stomach is bad, my eyes are deteriorating, my joints all hurt, my ears are hurting and I am struggling to keep working.	EXPERIENCE
This episode has been the worst I have had for a year and I am really struggling to get through it.	EXPERIENCE
Had colonoscopy/endoscopy last week get results on Wednesday which cant come quick enough.	EXPERIENCE
Just getting through each day at the moment is so so hard.	EXPERIENCE
Cant eat even drinking water makes me feel ill.	EXPERIENCE
Am desperate for some answers am tired of being told its all normal aches and pains, nothing wrong with you.	EXPERIENCE
Take antidepressants/valium god knows what else I have been given but its driving me insane.	EXPERIENCE
What ever is going on is cruel and makes it harder not getting a doctor to find answers for me.	EXPERIENCE
And doctors do not like to be told that you want certain tests done, its taken 3 years to insist on a Gastro referral from my GP and only got it because had blood in toilet.	EXPERIENCE
Am hoping and praying (unlike me) that I get some answers wednesday or I will be devastated again.	EXPERIENCE
I have been having this knive cutting pain in the middle of my stomach right behind my belly button.	EXPERIENCE
I have had every test done possible: Colonoscopies, MRI, Cat Scans , Exploratory surgery, capsule endoscopy.	EXPERIENCE
Every test I have had done comes back normal.	EXPERIENCE
I had the blood work done for Crohns and it came back negative.	EXPERIENCE
In 2012 my doctor retested me and it came back positive for a Crohns.	EXPERIENCE
My doctor did not want to label me with this.	EXPERIENCE
He said the test results should not change.	EXPERIENCE
My primary doctor wanted to redo the blood work and the lab would not accept it because they said I was already labeled with Chrons and it would not change.	EXPERIENCE
I just want to start on the medication to see if it will help.	OPINION
I have read symptoms and have a friend with it and our symptoms are alike..	EXPERIENCE
Any suggestions for me?	NOT_LABELED
Do you think I might have it?	NOT_LABELED
Pain is really bad after I eat.	EXPERIENCE
I had a salad today and didn't know what to do with myself cause of the pain.	EXPERIENCE
The only thing that helps is taking Oxycodone and using the heating pad.	EXPERIENCE
I am open for suggestions.	NOT_LABELED
Please help!	NOT_LABELED
Sara.	NOT_LABELED
I have been going thru all of this for over 10 yrs. I have had multiple colonoscopys and endoscopys and ct scans mri exploratory surgery where I had 4ft of my small intestines removed.	EXPERIENCE
I have severe abdominal pain all the time and cramps and blood in my stools and diarrhea and then times of constipation.	EXPERIENCE
I have severe bloating and my eyes get watery and blurry at times.	EXPERIENCE
I have been hospitalized for diverticulitis in the past for gastritis they have done all kinds of stool test and blood test all negative for crohn's and all the biopsies have been negative, they did one expensive blood genetic test and if was inconclusive but indicated some kind of inflammatory bowel disease.	EXPERIENCE
Have been referred to another specialist and fixing to have a gastric emptying test and mri entergraphy and HBT test and another colonoscopy and endoscopy and hoping that they would just find something that would come back positive so that they would treat me for crohn and stop telling me it is just ibs , i know my body and it is more than just ibs and i have never been more sicker or hurt as much as i do now.	EXPERIENCE
I have been having symptoms of Crohn's for 3 months and last year I had two other episodes with these same symptoms lasting 1-2 months.	EXPERIENCE
IBD blood work is positive for Crohn's.	EXPERIENCE
CT scan and colonoscopy are negative, but endoscopy shows inflammation.	EXPERIENCE
The doctor decided it was more likely it was just IBS, but I don't think I could be this sick for this long just from IBS.	OPINION
Any thoughts?	NOT_LABELED
I think you need to find a new GI doctor.	OPINION
It's not ok to blow off a patient.	OPINION
Find one who actually cares about your health and well-being.	OPINION
And insist on a camera endoscopy.	OPINION
It's the only thing that can show what is really going on in your small intestine.	FACT
I just had it done yesterday and am waiting on the results.	EXPERIENCE
I'm fairly certain my doctor thinks I have Crohn's even though most of my tests and biopsies have come back negative.	OPINION
I, too, show all the symptoms (diarrhea, abdominal pain, mouth ulcers, joint and muscle pain, red swollen eyes, exhaustion...), but they haven't given me a definitive diagnosis or a treatment plan.	EXPERIENCE
This has been a 3 month process of every test imaginable.	EXPERIENCE
In the meantime, I have picked up a few books on the disease to help me get on a Crohn's diet plan to help with the flare ups (half.com has many options for less money).	EXPERIENCE
Maybe this will help you too?	NOT_LABELED
Hopefully in another week I'll have my answers.	OPINION
Good luck to you friend!	NOT_LABELED
I am 38 years old.	FACT
I have been having symptoms of Crohn's for 4 months.	EXPERIENCE
I was send to do a fructan intolerance test.	EXPERIENCE
I came positive to fructan intolerance.Then the doctor order some blood test IgA Ref (38.9) IgG (55.0) possible crohn's disease.	EXPERIENCE
Then he order a video capsule endoscopy with a finding of significant mid- and distal small bowel lymphoid hyperplasia.	EXPERIENCE
Then he order a ct scan with results possible non-specific ileitis (demonstrate a thickened loop of the distal ileum which is nonspecific finding ) now he order a colonoscopy with ileoscopy to due a biopsy.	EXPERIENCE
He wrote that he whats to rule out lymphoproliferative process...	EXPERIENCE
I am supper worry.	EXPERIENCE
I cannot sleep...	EXPERIENCE
what is going on?	NOT_LABELED
Should I be supper worry?	OPINION
Can some one explain what all this means?	NOT_LABELED
Thanks for the help.	NOT_LABELED
The core of the problem is autoimmune, our immune keep atacking our body causes Ulcerative colitis or Crohn.	FACT
I got UC.	EXPERIENCE
Before my immune attacked knees joint, ankylosing spondilitis.	EXPERIENCE
I went to doctor but seems helpless because they kept trying to heal my joint.	EXPERIENCE
The problem is the auto immune.	FACT
It happened 10 years ago.	EXPERIENCE
Until I found mangosteen skin juice named xamthone (indonesia is my country) it helped a lot to control my immune and my joint healed by itself.	EXPERIENCE
I back to normal life and skip drinking xamthone mangosteen skin juice.	EXPERIENCE
3 months ago I got hemorrhoid and fistula, hurt so bad!	EXPERIENCE
