isEdited,review,title,date,rating,userName,body,id,modified
False,I downloaded it less than 5 minutes ago and it’s asked for a review 3 times. My review so far is to leave me alone and let me use the app.,Won’t stop asking for review,2022-03-23 00:28:27,1,Drewser33,,,
False,"When we are going for test,Doctor will be in network and when it is billed they will not be there. 
And they bill us, its so irritating.",Irritating Doctor list,2022-03-01 23:31:30,1,pruthvi09,,,
False,I have an apple watch not a fitbit! How does it work?,My Fitness,2022-02-07 20:27:46,4,Fkaplan,,,
False,It’s no fun to us this app. I have trying to log in for the past week but in vain. Have switched my insurance and already facing problem.,Very Difficult to log in.,2022-01-09 18:24:23,1,sharma j,,,
False,"This app is basically useless 
While other apps let you even set appointments in the same app in United Healthcare the section to finde a care specialist doesn’t even load",Worst healthcare app,2021-09-18 10:13:54,1,karigrz,,,
False,I went on this device and found this app and it downloaded it self 🤔😤😠🤯but I will rate it a 3,???,2021-09-15 01:07:51,3,Xtynktion,,,
False,"Can't search for providers, constantly says ""We are unable to load search results"" every time.",Broken,2021-07-14 01:31:24,1,Whatever0194959029395,,,
False,I love having all my health info at my fingertips,Great info,2019-10-24 20:34:39,5,AppleHiney28,,,
False,Took care of all issues at 800 # on back of card😀,United Healthcare is awesome!!!,2019-02-08 17:31:26,5,VolinskiLLC,,,
False,Love it. So easy to use and all my data and I’d card in one place.,Great and simple app to use,2019-10-24 17:30:29,4,schappy2,,,
False,I have not yet been able to log in. I’ve reset my password multiple times and still every time I try I get an error message. Worthless app unless I can actually log in!,Unable to Use,2019-07-08 14:37:13,1,Em.J85,We value your feedback and we are sorry to hear about your experience. Please reach out to us at uhcmobile@uhc.com so we can better assist you.,9556041.0,2019-07-08T20:16:50Z
False,Very easy and informative!,Convenient,2018-08-31 05:23:51,5,klee591,,,
False,I am content thankful 🚀,Thank you,2022-03-07 04:12:15,5,sumyoinguy,,,
False,Pretty easy to work around and get it done,Simple,2018-07-14 22:04:19,4,w.reck,,,
False,I love this app because it has all the info I need.,Great App,2020-05-11 22:02:23,5,Mrs. Evangelist,,,
False,"Had not received cards in mail, and card in app not showing all information needed. I feel I’m paying for insurance that I can’t use.",Unhappy,2022-02-06 15:03:15,1,thcuffjhfbgegkjfsetbjko,,,
False,"Missing info, like Rx details. Chat feature is decent. But if you’re going to offer fingerprint ID, make it work.",Lacking,2021-03-21 06:16:11,2,EndymionNomad,,,
False,Option to sync and log steps is totally gone from iOS 14 after last update. Reward only for Flu Shot & Wellness Visit. What happened to the Steps Reward??,Steps Rewards Missing!,2021-02-11 01:31:13,1,Rccola925,,,
False,I am currently trying to locate an urgent care facility that is covered under my insurance. Every facility that appears on the list on the app is either closed or not there.,Poor provider listing,2020-10-07 18:26:27,1,Indigo GODdess,,,
False,This app has a log in error. Has been for weeks. Deleted it and reinstalled.  ???? I can log in fine from website.,Won’t open,2020-08-24 04:52:07,1,Fergiefur,Hi! We value your feedback and are sorry to hear about your experience. Please reach out to us at uhcmobile@uhc.com so we can better assist you.,17630851.0,2020-09-01T15:11:16Z
False,Priceless: ),Having a medical attention at your fingertips???,2020-04-09 18:00:30,5,Stylishlyhott,,,
False,Definitely a lot better than my old BCBS app,The best medical insurance app,2020-01-19 04:25:56,5,KMSEHW,,,
False,Easy to use and accurate!,Natalie,2019-03-17 19:44:50,5,NatbSho,,,
False,"I have my HealthSafe ID, I attempt to sign in and get a message that says “account already exists” which I know since I’m signing in! The Health4Me app won’t log me in either. These apps are quite disappointing",Cannot sign into either app,2019-11-19 22:49:14,1,KatdieR,"Hi! 

We value your feedback and are sorry to hear about your experience. Please reach out to us at uhcmobile@uhc.com so we can better assist you.",11958130.0,2019-11-20T16:12:36Z
False,"Very easy to use, informative and convenient",First Review,2019-02-11 23:52:12,5,Trkrggm,,,
False,Seems like a good app so far; haven’t had to use it yet.,UHC app,2019-01-30 18:14:49,5,LoveECW,,,
False,Having access to my insurance is important to me and this makes it really easy.,R Cram,2019-01-30 18:22:46,4,1Chewy1962,,,
False,It’s really easy to navigate and understand!!!,Love it,2019-01-30 04:34:12,5,jbrady596,,,
False,Very helpful and resourceful recommend it to everyone,Amazing app,2018-10-03 21:14:21,5,sciontc16,,,
False,"Very nice app, easy to use and navigate",United Health Care made easy,2018-10-03 13:17:10,5,Yourmomsucks,,,
False,Better than the other app: Health4Me.,Pretty straightforward,2018-08-29 17:16:49,5,Yun.J,,,
False,Very easy to use and convenient,United healthcare app,2018-08-10 19:17:50,5,Ksmith4321,,,
False,"This is a good & an excellent app, very easy to use & very detailed!",Good & Excellent,2022-04-23 20:03:27,5,IsahJ1,,,
False,"Looks cool just downloaded, never knew we have an app, all excited to find out what's in store! Great job UHC!!",Very good app,2018-04-24 16:56:11,4,Abithegreat,,,
False,"When requesting a call, the app shows a “there was an error performing the requested function “",The contact us screen is broken,2022-04-26 21:38:46,1,Poach.in,,,
False,I can no long view or sink “my renew rewards “ account 😞,Poor app layout,2022-04-24 16:10:39,3,Grumpy Ed,,,
False,Liking,Liking the simplicity,2022-01-27 01:41:20,5,smvee910,,,
False,This app makes life a lot easier. :),Great App!,2021-03-03 12:22:50,5,C. Gip,,,
False,"The App Store page for this says it supports Apple Wallet, but when you pull up the ID card the best it can do is share as a PDF.",Wallet support is misleading,2022-01-09 00:24:24,2,UniqueNickname1837,,,
False,And got rid of the saved I did have.  Extremely frustrating,Not allowing me to save doctors,2021-06-10 02:53:17,2,Msstefanee,,,
False,Really happy with the ease of use and how convenient this app is.,The Best,2020-04-29 05:24:22,5,Amina Berkane,,,
False,"I have United Health and the app give me all the info I need to know.
Works great!",Great app!,2020-01-07 23:52:32,5,rdalca,,,
False,"Constant issues using the app, will not recognize log in & states does not recognize eligibility whatever that means even though all information is correct.",Terrible,2020-02-18 22:47:59,1,ejandem,Hi! We value your feedback and are sorry to hear about your experience. Please reach out to us at uhcmobile@uhc.com so we can better assist you.,13670812.0,2020-02-24T15:00:16Z
False,"This app is perfect everything is right there 
At the tips of your fingers.",UHC,2019-07-11 21:07:23,5,Chris Sobye,,,
False,"Always get the “circle of death” after logging in!  UHC support was unable to help. Can log in with my computer, but need to use mobile app to log steps from my Apple Watch for renew rewards.",Doesn’t open,2020-01-06 20:08:24,1,advantage plan,,,
False,This site is so user friendly!!,Love this app!!,2019-02-07 01:01:22,5,uh review,,,
False,"70% doctor information is outdated on this app very frustrating. Spent 30 min looking for an ENT doctor. Either the doctor doesn’t work there or the address/phone number is wrong in San Diego. Absolutely AWFUL!
UPDATE your information!!",Horrible!!,2019-06-24 20:45:00,1,glittergirlxo,We value your feedback and we are sorry to hear about your experience. Please reach out to us at uhcmobile@uhc.com so we can better assist you.,9404236.0,2019-06-28T14:48:48Z
False,Everything shown in 1 Dashboard. Very easy to use.,Great app,2019-01-08 14:10:01,5,godisgood4u,,,
False,Easy to use and stay on top of medical costs!,Easy peasy!,2018-11-08 21:15:15,5,PinkCashmere758,,,
False,"Every time I try to log in, it gives me a “oops, something went wrong, please try again” indicator. I keep trying it again and it gives me the same message. Please fix this.",Can’t Even Use This App,2018-12-31 13:44:25,1,msaliyahnj,We are sorry to hear about your experience. Please reach out to us at uhcmobile@uhc.com so we can better troubleshoot your issue.,6679488.0,2019-01-04T16:51:04Z
False,Thank you soo much.  Super easy and digestible information.,United Heathcare App,2018-10-26 23:14:02,5,lolo75us,,,
False,Great to have all my insurance info on the go,On to go,2018-10-25 12:24:14,5,wagstaffwn,,,
False,"I really love and enjoy this Medicaid provider, they’re really amazing!!!",Amazing Healthcare,2022-05-04 18:03:50,5,Lovely Girl 80,,,
False,Easy to work and navigate.,UHC,2022-02-09 19:13:03,5,Boopskooter,,,
False,United Healthcare is one of the biggest providers in the healthcare industry but you would never know it from this app. It is a lame excuse for an app—like their OTC program it’s useless.,Lousy app for such a big provider,2022-04-16 23:31:53,1,mac_guy1975,,,
False,"UHC app does not show coverages for Vision plans, only health and dental.  Only thing shown for vision plan is the membership card and it doesn’t show plan details either.  Not helpful.",UHC app needs to show vision coverage,2022-03-18 14:20:48,1,Kat636,,,
False,"He creates  fear to make the patient agree for more photos. I read similar review from other patient.
He didn’t solve the issue I came for .
All what he care about is making more photos for a bigger bill .
Horrible experience. 
He is the only person there . Look at his history moved around several states????
He billed me for service he didn’t do .",Horrible attitude,2022-02-21 07:11:03,1,kyanoosh 77,,,
False,"The app is easy to navigate, informative and really convenient! I love it!",5Stars,2019-02-03 18:41:50,5,SerialAppUser,,,
False,I downloaded the app and it’s not even usable. Login works on UHC website but not on the app. Even after I tried to reset password. Waste of time,Can’t even login,2021-02-10 23:47:20,1,ethmai21,"Hi! We value your feedback and are sorry to hear about your experience. If you are experiencing technical issues or have questions about this app and you have a health plan through UnitedHealthcare, please call: -- Employer Plans: 1-877-844-4999 / TTY 711 – Available all day, every day -- Medicare Advantage Plans: 1-800-721-0627 / TTY 711 – Available 7 am – 10 pm CT, 7 days a week -- Medicaid & Dual Special Needs Plans (DSNP): 1-877-542-9239 / TTY 711 – Available 7 am – 7 pm CT, Monday – Friday",21268658.0,2021-02-24T15:11:30Z
False,Currently unable to login on the app even though I can login via web browser. Please fix this.,login issues,2020-06-19 13:07:26,1,Dyskord,Hi! We value your feedback and are sorry to hear about your experience. Please reach out to us at uhcmobile@uhc.com so we can better assist you.,16147469.0,2020-06-22T14:55:05Z
False,Reset my password thinking I forgot it. Nope. I just get an error every time. Does this mean my plan doesn’t support the app? I’m trying to add my ID to my phone since UHC hasn’t sent me my new ID yet. Any help would be appreciated!,Can’t log in at all.,2019-10-26 18:30:21,1,juliusmarelle,Hello! We value your feedback and are sorry to hear about your experience. Please reach out to us at uhcmobile@uhc.com so we can better assist you.,11515453.0,2019-10-28T15:20:51Z
False,Easy to navigate,Easy,2019-01-23 05:36:18,5,Gamermom66,,,
False,Love the app!  So convenient to log in and see claims and payments.,App works great!,2019-01-23 01:19:40,5,Msjetlag,,,
False,The app is extremely easy to use and locates DRs/specialists easily.,Easy,2019-01-07 06:03:56,5,Michaelego1,,,
False,App is easy to use and responds quickly.,Kita All,2018-12-18 17:07:54,5,kitaall,,,
False,User friendly.  Easy to use.  Well done.,Awesome!,2018-11-20 15:13:02,5,Chewbacca54,,,
False,"This app is awesome all the way through, a must have!!",👍👍👍,2018-11-15 03:10:39,5,Skullei,,,
False,I love using the app. No more having to talk to anyone to look for a Dr.,Perfect,2018-07-31 23:42:03,5,Ma_Pretty,,,
False,Great easy app when on the go.,User Friendly,2018-08-29 15:33:38,4,rsmithjr0407,,,
False,Find doctors easy. Very helpful and easy to use! Get it.,Good app,2018-07-17 17:52:32,5,TanG7010,,,
False,Fantastic and user friendly,Great,2018-07-07 17:25:37,5,Dhsjensjd,,,
False,Dental is a small part of my uhc coverage and because the first Dr I looked for was my dentist the app and website always defaults to dental.  Apps and their f———ng cookies.   Through out the cookies and let me navigate on my on.,Sorry app,2022-03-31 18:55:11,1,"$&@""-:)",,,
False,Very easy to navigate and fast.,Love App,2020-08-02 14:06:25,5,MsBabyface2,,,
False,Nothings working I can’t view anything it just keeps saying sorry not available. My insurance card is not showing.,Not working,2022-03-10 19:20:59,1,ivjones11,,,
False,Not user friendly at all. Confusing interface. The only thing worse than the health insurance experience is this app.,👎🏼,2022-03-04 21:01:39,1,moses aurelius,,,
False,It’s great. There should be an option to add to apple wallet. For even easier access.,Apple Wallet,2022-02-01 14:44:21,3,cortezea,,,
False,I don’t understand why UHC has decided not to allow access to Medicare supplements - making me have to use a web site.   How ridiculous.,Medigap Plans not using app,2022-01-11 10:31:24,1,Bostonimann,Hi! We value your feedback and are sorry to hear about your experience. Please reach out to us at uhcmobile@uhc.com so we can better assist you.,27447541.0,2022-01-14T15:09:56Z
False,Before you could send a message and receive information. Now? Nothing.,Lacking,2021-02-06 21:18:13,1,mgiuffre,,,
False,Excellent with information that I access at anytime.,UNH AP,2019-11-12 22:36:07,5,DJS.Wifee,,,
False,"This app is so out of date.  There are doctors listed that have passed away, there are doctors listed that no longer living in this town.  Very disappointed in this app.",Poor app,2020-06-29 17:30:47,1,Susy Ross,,,
False,Please allow Health insurance card to apple wallet!!!,Digital card,2019-09-02 13:02:42,5, Daryl Ayala,,,
False,"Access to history, card, billing. This is great!",Love it!,2019-04-15 02:34:23,5,HMShades,,,
False,"I love this app, it gives me access to my insurance claims and deductible balance.",Love it,2018-12-22 14:00:49,5,Snowball1987,,,
False,I like the fact that it locates the doctors for you.,Useful,2018-07-17 16:29:53,5,Gerrywithab,,,
False,This app is so helpful and easy to use on the go!,Great Help Easy to Use,2018-05-31 04:15:57,5,Adtemple,,,
False,Easy to use.,Excellent,2022-03-07 01:49:38,5,Francisco Juarbe,,,
False,Very well put together,Great app,2020-08-22 22:51:28,5,tamiepoohbear28,,,
False,App is horrible and not worth all the trouble. Touch ID does not work. Constantly closes when you select something.,Horrible,2022-03-04 13:45:34,1,dryikhv,,,
False,It is impossible to use the online options. No happy at all,Search for coverage and providers.,2022-02-04 00:39:56,1,Marilyn DP,,,
False,"Works great, a must-have for anyone with UHC",Intuitive and useful,2019-11-18 18:25:27,5,Bruh20101937494748999@,,,
False,Surprisingly easy to use and helpful,Great app,2019-02-22 16:29:58,5,Trrrw112,,,
False,"The health part is good and convenient but it does not include the dental portion of my insurance coverage. Since UHC covers both I thought it would show both but no, only the health portion. It gets 2 1/2 stars.",No dental,2019-09-16 19:25:11,2,Monsta73,,,
False,Has all my card info love it,Good app,2018-12-20 03:40:20,5,bbbeez23,,,
False,"Very easy to navigate and simple to use. I like the, “bare bones” aspect of it. Does as it promises.",Simple and Intuitive,2019-02-18 22:56:53,4,ILiveOnAMountain,,,
False,The app has worked properly for me,Great app,2018-11-06 15:03:22,5,daniad11111,,,
False,This app is amazing. I don’t need to worry abt not checking for my claims etc.,Awesome,2018-09-04 19:45:57,5,Amalilly,,,
False,Love having my info at my finger tips,Busy mom,2018-06-28 23:05:10,5,bisy mom of 2,,,
False,It’s so simple to navigate and use.,Simple,2018-05-09 17:21:19,5,ingo der toll,,,
False,I am glad that I chose united health care to take care of me,Nice to have a mobile app,2018-06-08 01:41:22,4,Manny0278,,,
False,"Easy to navigate. Get you right to the point. The are improving and will
Soon have claimed availability.",UHC awesome,2018-05-26 02:00:15,4,MarieClarkOnline,,,
False,I have nothing negative to say about this app.  It is an Awesome App!!!,Great!!!,2021-01-09 17:53:21,5,LadyDee100%,,,
False,The UnitHealth Care app isn’t user friendly.  The screen is small and I don’t see a place to opt for a full screen.  This is one of several complaints about the app.,UHC app,2022-05-06 22:39:43,1,hampsome,,,
False,Horrible,Horrible functionality / Inaccurate information / Not intuitive,2022-02-08 04:58:25,1,amyd20,,,
False,"App is super user friendly 
Lots of tips
Very helpful",Great app and great health care,2020-03-18 04:04:34,5,Mollzmagik1479,,,
False,It has been days that the app says oops try again when I try to log in. I have no problems logging in through the website...,Not working,2020-05-04 22:39:00,1,adn9276,Hi! We value your feedback and are sorry to hear about your experience. Please reach out to us at uhcmobile@uhc.com so we can better assist you.,15107601.0,2020-05-05T16:56:04Z
False,Nice and easy navigation. Consistent with website.,Nice App,2019-10-14 21:41:07,5,Chaitanya@81,,,
False,Very good UI and very user friendly,United Healthcare app for iPhone,2019-01-09 13:44:34,5,BoSawxFan,,,
False,Easy to use so far,Excellent app,2018-10-19 03:21:22,5,sandnab,,,
False,Work well and helpful with wellness list.,Good for general information,2018-11-20 17:35:46,4,S. Cragle,,,
False,Love it and its very help with current information.,Great App,2018-07-05 19:26:43,5,Ten410sion,,,
False,"On app cannot look up a doctor by name, nor look up a specific business by name.",Doctors list preference,2022-04-18 17:42:22,2,DjC Fla,,,
False,You have an app where you cannot access your coverage information. Why have the app at all?,App needs help,2022-04-06 20:04:39,1,Lyria21,,,
False,Not enough info.,Not deep enough,2022-02-06 16:43:17,5,sestein,,,
False,My daughter has as,System always down,2022-03-19 16:44:33,2,Bendover!,,,
False,"Can’t navigate app without Rating prompt popping up constantly. Hoping that writing this review makes it stop, but doubt it.",Too many surveys.,2022-02-13 13:16:37,1,TheRealDaveShow,,,
False,Really like this app. It is easy to use!,App Review,2020-08-01 16:25:57,5,Jody E.,,,
False,You need to provide claim details,Incomplete information,2022-02-04 00:44:40,3,BoppeR6464,,,
False,I have two policy’s snd I can’t tell which police has paid snd which one hasn’t until I get the paper explanation. Would be nice to view online,Claims online,2022-02-02 03:08:48,1,dblnke55,,,
False,Prompted for an update - at the dentist office and couldn’t access the card because of that. Should be able to defer update -,Unable to use,2021-06-12 19:53:35,1,Ralphkramdenii,,,
False,Functional and easy to use!,Great App!!,2020-04-15 12:04:03,5,facedpancake991,,,
False,But the app came thur for your girl!!!,I left my card!!,2020-02-06 15:01:20,5,tippfip,,,
False,I been trying to sign into the app a week or so with no luck.. I think this would be a  priority for such a large health organization. Maybe it’s time to in some outside professionals.,Trying to sign in,2020-02-25 19:58:19,1,RobbyV47,Hi! We value your feedback and are sorry to hear about your experience. Please reach out to us at uhcmobile@uhc.com so we can better assist you.,13809592.0,2020-03-02T15:03:44Z
False,Works exactly the same as the website. Love it!,Great Healthcare App,2019-01-03 04:22:06,5,1Nae2,,,
False,"Tried to log in for over an hour only to get “Sorry, something went wrong. Please try again.” every single time.",Log in issues,2019-02-07 19:41:34,1,gsnail,We are sorry to hear about your experience. Please reach out to us at uhcmobile@uhc.com and we will do our best to troubleshoot your issue.,7298735.0,2019-02-14T14:44:33Z
False,I love how I can view claims quickly and easily.,Love the app,2018-11-02 18:01:33,5,Chireluvamusiq,,,
False,Honestly it’s supper easy to use! Found doctors as easy as 123!,great app!,2018-10-08 19:40:55,5,Rubj123,,,
False,"Great app, easy to navigate, helpful!",Convenient!!,2018-08-20 12:17:16,5,L126141B,,,
False,Condensed and easy to navigate,It’s so simple,2018-07-19 20:27:42,5,MsBrandiboo,,,
False,Keep your life better,Joseph70,2018-04-25 19:22:25,5,jajeanc,,,
False,Review letters are white on white... sigh.  It would be great if I could add insurance cards to my digital wallet.,Could be better,2022-04-18 13:46:47,3,billiousprime,,,
False,"Fails to offer an iPad version of the app, thereby depriving us of using the superior iPad options and screen. With no iPad version we are forced to transact on the small screen of an iPhone.",NO iPAD VERSION OF APP,2022-04-18 22:02:24,1,LeonJon,,,
False,App randomly doesn’t recognize passwords. Even after successfully resetting.,Password issues,2022-04-16 19:24:50,1,KT-review,,,
False,This has to be THE easiest and most useful app I have ever used! One word: AWESOME!!!,ML Benston,2020-11-24 18:15:03,5,Misterintellectual,,,
False,You can’t see your results from the app or the email they send through UHC. I spent 49 dollars for 2 minutes and I can’t even see the results ?!?!,Teledoc,2022-03-01 14:52:04,1,Sassy chelle 45,,,
False,Very difficult to find sync activity button,Sync activity,2022-02-20 12:55:07,2,sync button,,,
False,"The website is totally different than last year and I am having trouble maneuvering. Also, my Covid vaccines are incorrect.",Different,2022-02-03 01:43:36,1,jjsuhc,,,
False,It used to have many features. The new app is useless. I have to login to web to see more details. This is somebody’s bad decision.,The new version is very bad,2022-01-22 01:23:43,1,12crkr24,,,
False,My plan isn't supported by the app and trying to login says so but gives no help beyond that. That's a zero star experience if I've ever had one.,Plan not supported,2021-11-29 01:07:39,1,NicknamesAreMyAntiDrug,Hi! We value your feedback and are sorry to hear about your experience. Please reach out to us at uhcmobile@uhc.com so we can better assist you.,26673103.0,2021-12-06T15:26:28Z
False,"I get this message when signing in IOS 14.8. App has worked every day in November until 11/24 Called support, no help. Please fix your app",Plan not supported,2021-11-25 01:08:47,1,tlklatt,Hi! We value your feedback and are sorry to hear about your experience. Please reach out to us at uhcmobile@uhc.com so we can better assist you.,26673101.0,2021-12-06T15:26:21Z
False,"Non functioning provider search, uninstalling the app didn’t resolve the issue.",Provider search doesn’t work,2021-07-14 15:35:46,1,Rooooooodjnebfjuevevwcgshfgh,,,
False,Easy to use!,Easy to use,2020-06-22 17:23:07,5,uhcok,,,
False,This app is so helpful and easy to use!!,Amazing,2020-01-28 19:52:58,5,gracers86,,,
False,One of the best app in modern technology. Easy to access. It’s a complete package.,Great App,2019-09-05 03:39:23,5,Eric Dexcom,,,
False,Just opened this terrific app. So much information will certainly be very helpful.,GMB,2020-01-01 23:04:15,4,Boneman3,,,
False,"Great app, all the information you need at ur fingertips",A++++++ App,2019-06-15 02:33:16,5,Toeknee65,,,
False,Like this app!  Like that it has my HSA balance!,Convenient!,2019-01-12 21:31:46,5,VonneVon,,,
False,I love having all this information at my fingertips!!,Love it,2019-03-07 17:43:53,4,SeniorHealth,,,
False,Nice lay out and very easy to use!,Easy to use,2019-01-10 03:03:50,5,KatelynK021,,,
False,Very easy to use and has great navigation.,Great App!,2018-10-25 15:27:37,5,Jorokzbeat,,,
False,Every time I go to log in it says “oops something went wrong” I’ve had it for 4 months and have only been able to successfully log in.,Never fails,2019-01-09 22:39:22,1,MandaaTorres,We are sorry to hear about your experience. Please reach out to us at uhcmobile@uhc.com so we can better troubleshoot your issue.,6867333.0,2019-01-16T13:57:27Z
False,"Just received my uhc card and register an account. Try to login but return error message saying something went wrong, which is not useful at all.",Cannot sign in,2018-12-23 04:36:33,1,Acaptor123e,We are sorry to hear about your experience. Please reach out to us at uhcmobile@uhc.com and we will do our best to troubleshoot your issue.,6579749.0,2018-12-27T19:47:53Z
False,This app stinks. I put in all info and it would not accept. Tried to call customer service. Long wait times. Got out on call back list. Got a call and waited and waited. Nothing.,Bad service,2018-09-01 01:05:43,1,Goolie132,We value your feedback and we are sorry to hear about your experience. We have shared this with our technical support team. Please send us your contact information at uhcmobile@uhc.com and we will reach out to you.,4933587.0,2018-09-04T13:54:53Z
False,Very easy to use. Access to healthcare card on the app.,Great Healthcare app,2018-08-30 12:37:55,5,Dompack86,,,
False,This App has nice features and capabilities.,Convenient App,2018-04-27 11:26:26,5,rallenfire,,,
False,Easy app to use,Benefits,2022-03-28 20:21:07,5,@King102763528,,,
False,It is almost impossible to find how to sync my iwatch with step activity in the app. Now since the update cannot sync at all.,Renew rewards,2022-03-29 16:34:09,1,Kabrodhagen,,,
False,It’s good. Simple does what it’s supposed too.,Good,2021-05-17 21:27:38,5,gonzobrown45,,,
