isEdited,review,title,date,rating,userName,body,id,modified
False,Have used UHC for many years and have been very happy with both products and services. Their app is set up well and easy to use. I'm a satisfied customer!,Satisfied Customer,2021-01-01 16:38:08,5,Ddm129,,,
False,"A good app. Lots of information available, but there’s always room for improvement. Be thing I’d like to see, is more information on claims. Should be a link to explain a claim in detail, especially when a claim is not paid.",A good app,2021-01-10 17:54:19,4,rich89441,,,
False,"I seriously love this app. It gives me all of my resources at my fingertips. It has made it so much easier to find providers, see their reviews, distance from me and so much more. Very convenient!",Love!,2020-12-28 17:21:41,5,Shemeka717,,,
False,App is very easy to use and find what you’re looking for. It’s also easy to understand. No more trying to figure out what a letter in the mail is trying to say!,Great app,2020-06-19 13:16:33,5,sangria2020,,,
False,"We use the UHC app on a regular to daily basis. The information provided is excellent. The tools provided are easy to navigate. They allow payment and notes to track my expense out of pocket. Overall, it is a great application from an excellent health provider.",UHC App,2020-03-04 23:01:06,5,Singin2Him,,,
False,"It’s a good effort but after multiple tries over several months, this app does not function correctly. It won’t show the deductible balance for my spouse, even though it can show all of her claims. Several other fails, but I am too frustrated to list them, as I now must go to my laptop to get this information I need. Whatever they paid to develop this app, they need to get a refund.",Tries but fails to do what it’s designed to do,2020-05-12 21:54:35,1,GrooveCurrent,Hi! We value your feedback and are sorry to hear about your experience. Please reach out to us at uhcmobile@uhc.com so we can better assist you.,15705177.0,2020-06-01T15:44:05Z
False,"Making healthcare and insurance intuitive, easy to use. The UH app has done the seemingly impossible. Everything you need is a click or swipe away. Nothing you don’t is there to clutter the experience.","Great, easy to use app.",2019-05-27 12:04:39,5,miseha,,,
False,"If I could rate zero stars, I would, because that’s precisely what I’ve gotten out of this app. It doesn’t offer any of the most useful information, and is practically useless for me. It doesn’t outline my coverage (summary of benefits), which should include vision, so I have no way to search for in-network vision providers at all. I’m now going to have to go to all of this area’s optometrist websites searching for which ones take this insurance. Ridiculous!",This app is crap,2019-11-09 22:36:37,1,djdir dos,"Hi! 

We value your feedback and are sorry to hear about your experience. Please reach out to us at uhcmobile@uhc.com so we can better assist you.",11779165.0,2019-11-11T15:18:01Z
False,The app is fine. It would be great if it had a function for you to make an appointment with the doctors directly with the app. That way the insurance will see it and you have access to it. It makes it easier than having to call and do everything manually.,Something added,2019-10-15 15:22:04,3,Raigefire,,,
False,I couldn’t be more at peace and thankful that I switched to UnitedHealthcare. Everything so far has been so smooth. The employees I’ve been involved with have been absolutely the best.,UnitedHealthcare,2022-04-16 12:02:54,5,Willidok,,,
False,"I love using this app to schedule my virtual appointments, to keep track of my deductible, and to keep track of my health expenses.

The app works great and every update makes it even better!",Reliable,2020-12-21 18:11:17,5,Jeffinner,,,
False,"This app is very useful , I could use all the health  benefits from this app very quickly , staffs are very responsive and helpful on giving an outstanding service on every health care matters.",This app is very useful,2020-05-11 04:31:59,5,Oh!ya oh!ya,,,
False,I absolutely love this app. It is spot on when it comes to my coverage for medical insurance. It shows my claims that have been processed and helps assist me in finding new physicians in the area. The app is user friendly and very convenient. Highly recommended!,Best APP,2019-12-05 12:34:47,5,Miss_Liss10,,,
False,This app helps me to maintain correct doctor appointment and claims. Each appointment I attended showed how much I owed to hospital and how much the policy covered. It’s pretty handy and useful so I highly recommended app user to download it! Thank you UHC!,Easy access and clear information,2019-11-21 16:28:02,5,kolya117,,,
False,"I was having issues accessing my account on my computer, so I downloaded the UHC AARP app. It was just easy to do and the information I wanted front and center! Very pleased!",Happy with your app!,2022-03-17 13:53:15,5,Happy UHC gal,,,
False,Very easy to use and convenient. Checking for claims and finding providers at my fingertips. Makes my life easier.,Very easy to use and convenient,2021-05-28 16:23:17,5,ThisDoll,,,
False,"Easy to use. Self explanatory. I recently had open heart surgery and this app has been great regarding what I may owe, what has been paid, etc. a very user friendly app.",Easy application,2021-04-20 17:11:17,5,Sydneyz101,,,
False,This app makes it so easy to access medical history on a insurance level. Also I love that my cards are easy to access and navigation is seamless.,Black and white,2021-02-03 06:28:27,5,DarianV,,,
False,"United Healthcare’s app is one of the easiest I’ve ever had! United Healthcare has taken care of my family’s insurance needs with help available 24/7, a caring nurse case manager and answer to all my questions! Thank you United Healthcare❤️",Best insurance experience ever!,2020-01-21 15:54:10,5,luckijenni,,,
False,"Love the new UI. Seamless and simple. Has made searching for, keeping track of providers in my area so easy. Would recommend anybody who has United to download this app and start using it for all your UHC needs.",Easy of use great!,2019-11-20 16:39:07,5,JFBuck123,,,
False,"The ‘Contact Us’ is excellent. They’re available 6a-8p & you’re able to speak to someone immediately. 

Your benefits/claims/info are well organized & easy to navigate. 

Digital ID card is handy as well.",Easy to use. Great app,2019-08-29 01:25:22,5,Reagansburglar,,,
False,This is my first pregnancy and having the United Health Care app has put me at ease. I can easily see how far until I reach my deductible and am able to contact someone easily if I have any questions.,Easy to use,2019-01-20 12:13:20,5,TinaJed,,,
False,"I’ve used the Aetna and Cigna apps for previous employer sponsored insurance, but this app is much more user friendly than those. The UHC website is also good, but this app is even easier than that.",Better than other insurance apps,2018-12-28 18:15:11,5,k-reps,,,
False,Being able to find a doctor in-network at my fingertips is awesome and being able to see how much is left in my flexible spending acct is by far the best thing. Thank you for a great app.,Best health care app so far,2020-01-28 21:49:46,5,noneyapoff,,,
False,"The app itself is mostly simple and easy to use. 
Saving providers, pharmacies, etc to your profile isn’t though. 
The biggest thing it needs is a dark mode version.

There is a bug that instead of being able to review the agent after a chat conversation, it crashes and closes the app instead of giving you the survey. 
Which is a shame cause the rep I chatted with was great, and I didn’t get to give them a good review.",Needs a dark mode option & chat crashes,2021-01-28 22:56:57,4,Jmanorama,,,
False,"This app has been incredibly useful, I particularly love being able to see my claims and account balances without having to log in to a completely different website.",Great App!,2020-01-01 19:00:24,5,MaraeaHokulani,,,
False,Really like this application! It tells you claims you still owe for things like Doctor’s visits and you have your insurance card available on the app.,I finally have access to my insurance card 24/7,2019-03-01 00:15:12,5,BUHALL1,,,
False,Loving how easy it is to use. from my medical card to Covid pass or even looking through my medical history. Should have downloaded this way sooner!,Amazing App,2022-03-31 15:00:21,5,Mccv5,,,
False,"This app is a must, allows current status of all medical costs and deductibles. So much easier than paper reviews and it is always up to date.",Healthcare app,2021-06-10 17:30:33,5,KMO000700,,,
False,"I wish it were possible to pay claims through the app, and I certainly wish it was possible to add an Authenticator app to better protect my profile.",Overall a good way to manage claims on the go,2022-03-18 15:30:46,4,ironjohnsharp,,,
False,Very hard to get real up to date on OptumRx. Very poor website Not even a pharmacy person can see what I see.  This site needs to work better or I will need to ask my retiree Group to back to Express Scripts.  At least their website works,Not a clear site,2022-01-31 23:49:36,3,Frustrated CPG RETIREE,,,
False,I actually love the United Healthcare App. Easy to access super helpful. I used to spend hours on the phone to get this info and it is less than 5 mins to get what I used to.,Super Solid App,2020-05-31 13:20:05,5,amdk1234,,,
False,"Thank you for writing such a great app. The UI is sleek and intuitive and the app runs smoothly. 
I have a feature request I want to submit and that is to have my Medical ID Card be exportable to Apple Wallet. Thank you!",Great app! Feature Request,2020-01-13 15:44:36,5,eduran0826,,,
False,Down loaded the app. Love it but needed additional help for my problem and called the number you supplied and spoke with a Mallory. Who was extremely helpful so that I could better understanding my Rx formulary.  Been an enlightening 35 minutes.    Thanks!  🤗,Review,2019-09-03 21:47:51,5,Just jlm,,,
False,This app is so user friendly and simple to use ! I was running up for my appointment and created my account in a matter of minutes! Honestly saved my life today since I lost my medical card.,Awesome app,2019-06-24 14:16:34,5,ayoitsmari,,,
False,I’ve lost my insurance card several times and downloading the app has been such a help. It’s fast and easy to manage plus you are able to view your claims.,Download it now,2018-10-24 02:10:21,5,Denebc,,,
False,It’s coming along nicely but yet doesn’t have all of the functionality of Health4Me. Right now functions are split between the two apps. I would anticipate all the primary functions will eventually end up here. It would be nice to have some direction from UHC which app to use going forward.,A good work in progress,2018-04-25 12:50:33,3,JWarcop,,,
False,I have used a couple of other insurances’ app and this one is so easy to use and I don’t need to click other tabs to learn about my bills. Thank you!,Best App,2021-05-15 01:55:13,5,NtxawmZooNkauj,,,
False,"This app makes handling my family’s medical needs easy. Whether keeping track of claims or finding a doctor, this is my go to.",Convenient,2020-10-07 11:51:43,5,GuyanesePrincess,,,
False,I love the app but it is extremely frustrating that when I need to save a copy of an EOB to email or print (in most cases for hsa claims). I have to exit the app and login to full website. This is a huge feature gap for an otherwise well design app.,Great features no way to print or save EOBs,2021-04-10 15:18:04,3,learley2000,,,
False,"One of the most convenient apps. So easy to find all the important details. Whatever you need, it is only 2 or 3 taps away. Great! Detail of billing and deductible details. Software written for humans! Thank you!",So user friendly!,2020-02-28 03:00:50,5,best of the USA,,,
False,This app is so simple to use! I can see all the information I need and search for providers without having to spend hours on the phone.,So much information!,2020-02-20 22:57:15,5,MrsOpi,,,
False,"This is easier to use and to have access with.  The Previous app did not want to open half the time, but the new UHC app is great!!! I would recommend it to all my coworkers.",Easier to use,2019-10-21 20:04:49,5,Cherokeeangel3,,,
False,"Its a great app and very easy to use. 
It helps you to store and see your all insurance information electronically.
I think its a user friendly application and gives all the information about your insurance.",Very Usefull,2019-01-22 04:19:37,5,HSB corp,,,
False,"Logical layout and ease of use. Much better than the website. Easy to find what you need, and loading times are relatively quick.",Easy and convenient,2018-11-09 10:21:06,5,notyoubutme1000,,,
False,"Easy to use, has everything at the touch of a button.",Has everything...,2021-04-11 23:54:09,5,OB314,,,
False,"Only select few of pharmacies are on this app. You can't search for Walmart, Sam's Club or Meijer just to name a few. There are more pharmacies other that CVS, Walgreens & Kroger. Chat was not helpful AT ALL! Kept telling me to download the app or go to full website. Ugh! The app says it's 4yrs old! It's not new! Health4me worked just fine. It was way better than this app! It's going backwards in the design.",Pharmacy list?,2021-11-17 00:57:47,1,Lovejeeps,,,
False,"Is awesome because it saves your medical history. Should you need to recall dates, etc.. This is a great way to update existing doctors or provide information to new doctors. Great to view your medical spending history too.",UnitedHealthcare app,2019-02-26 15:15:17,5,aura ,,,
False,The app works well and shows most of the information I need but why can I not export my insurance card to my Apple wallet like every other insurance app? This basic functionality would make finding my ID card much quicker and easier! Please add an option for this.,Cannot add insurance card to Apple wallet,2020-04-27 16:35:14,3,BlakeBrauer,,,
False,I just downloaded and created account. Great.. Now would it be possible to allow rotation to view sideways? Fonts are too small and side view on other apps helps in such case. I can zoom/pinch some areas but text gets cut off since I can’t pan around. Please consider people with not so great eye sight,Fonts too small,2020-01-14 01:24:23,3,oxoocoffee,,,
False,Everything you need is right at your fingertips along with recommendations for exams.  Provides information in your area has all your claims along with a copy of your medical card.,Easy app,2018-11-12 17:13:53,5,gibbysmh,,,
False,"Thank you for an app as easy & convenient as this one. It make like so much more easier. At the click of a button, location, search, you are directed to the best doctors/physicians near you.",United Healthcare App Conveniently Easy,2018-11-07 16:53:04,5,Maxy Phooh,,,
False,Has everything you need and more to manage and keep track of your visits and copays! Very easy to navigate and very easy to sign up and use! Defiantly a must have for today’s fast paced lifestyles!!!,Very helpful,2018-08-28 03:32:47,5,Hoaks22,,,
False,"Love this app! It’s so convenient to see all of your information, billing, and find providers all in the same place! Easy to use and navigate — well done!",Love it!,2020-12-07 23:28:32,5,raemills4,,,
False,"Have tried and tried again to get into this app, just to get kicked back to the app asking me to log in again then asking me to go to their email sent to my email address and follow the instructions to receive a ID number … which is list in this loop somewhere … I never get anything anywhere 
Maybe I just picked the wrong insurance company.",Just Promises,2022-03-27 18:54:00,1,KathyAdams49,,,
False,I am very pleased with this app. It is so easy to go in and look at my claims processed. Easy to read and you can see the full explanation of benefits in pdf format if you need to.,Excellent App,2020-07-11 13:04:25,5,Kathy in GA,,,
False,"I’ve had this app for the past 12 months and about once a month my password will not work! So I update it as I just did and when I went to use it, no luck. Not sure what to do about it:((",Can’t keep a password for over a month,2020-09-17 23:46:13,3,mdb?,,,
False,"Keep up the great customer service, always very caring and patient.
I like the “Face ID”, saves time and frustration looking up another password:",Easy to navigate,2020-06-04 00:20:39,5,eamjr49,,,
False,I would like to be able print all my claims by phone and e-mail by phone to my secondary insurance. This can have delays in my payments but other than that great app!,Print from phone,2020-01-02 15:27:37,5,Pet 22,,,
False,With all of the hoops we have to jump through for coverage the app helps make it simple. Everything in one place!,Finally something with health care that is easy,2019-12-13 20:58:40,5,Princess kimmie,,,
False,I use this app a lot more lately. I find it easy to navigate around and it seems well laid out. Sure beats sitting on hold with the phone.,Easy To Use,2021-01-17 19:05:13,5,Fircrestshooter,,,
False,"UHC denied a claim for CPAP equipment for my obstructive sleep apnea, saying “we understand you’re insured under another health insurance policy,” and demanding that I send them documents showing my coverage under this other policy. The “other policy” is also through UHC and is linked to my UHC portal account. UHC is requiring me to send them information they already have. As a longtime UHC customer, this experience is disappointing.",Bad Experience,2022-05-03 20:50:37,1,DSL713,,,
False,"From location data, updated FSA info, claims, results, everything. 

Definitely a well maintained app with excellent user friendly menus.",No frills but EVERYTHING you need,2020-09-01 16:56:02,5,Blucifers,,,
False,"This is best and easiest to navigate insurance app I’ve used. Card, Doctor info and search, In- Network info, cost estimates, claims, prescription info, all with a tap.",All info at Fingertips!,2020-08-07 18:15:33,5,Brenda1022,,,
False,"Keep up the great work. This app is very easy to use, self explanatory. Highly recommended. 
Will always use to keep up with my clams, and other services provided.",Great app,2020-06-05 20:12:59,5,ncdreaming1,,,
False,This is the first product I have seen from an insurance company that actually brings the best in class from social and consumer  technology  to health care !! I recommend it to anyone with UHC,Finally someone brought digital to health care,2018-09-23 17:52:14,5,Super,,,
False,"I really like the App as it is super easy to navigate.  Easy way to find a Doctor; Billing Information, maps to locations etc.",Great App ... easy to use,2021-03-04 17:39:17,5,Shawiak,,,
False,"I love being able to go to the app to immediately see if a doctor is in network.  They often give the wrong phone numbers, though, so you may want to Google it before you call them.",Very nice and helpful,2018-09-19 20:54:48,4,Tctjft,,,
False,I’ve been calling back and forth doctors that are listed in network in this app and every time I call the information is incorrect for instance it says primary care and when I can that doctor it turns out they are internal medicine like wth I don’t have all day to call every single number and get turned down,Finding doctors In Network is impossible,2022-03-28 17:30:52,1,uruncleismywife,,,
False,"This App says it supports Apple Wallet, yet I don’t see an option to upload my insurance or my vaccination card into Apple Wallet. I was able to do this with my previous health insurance company, so I’m not sure why this App says it supports Apple Wallet.",Apple Wallet?,2021-10-26 01:28:50,4,SDinOC,,,
False,"I had a good experience using this app to get info on my health plan, including coverage, deductibles, and claims. You can track details on claims over specific periods. I give this app a top rating.",Excellent App for Tracking Health Plan,2020-04-15 02:02:14,5,Q. Publius,,,
False,This app is well put together and easy to use. Only thing it is missing is having the ability to making doctors appts with it,Easy to use,2021-02-21 08:19:30,4,Nizaliath,,,
False,Easy to navigate and all important info is right up front. Was able to get in touch with a very kind and helpful nurse immediately when needed. That alone earns 5 stars.,It's a winner,2020-01-15 02:46:37,5,psychloveralways(:,,,
False,Last year my particular plan was not available however it became available just recently and love having it available.  Use it often.,Beneficial for quick look ups!,2020-02-12 14:05:01,4,Sucent,,,
False,"Every single time I attempt to log in, it gives me the error of invalid ID, with the not so helpful tip that it now uses healthsafe. That’s cool. In fact that’s the credentials I am using. But still failure persists. I try to “create hsid” but, obviously, my account had already been created. 

The kicker, is that if I go to myuhc via a web browser and use the exact same credentials I use in the app, boom, I’m in no issues.",Constant log in issues,2020-01-31 23:22:57,1,tkauftheil,Hi! We value your feedback and are sorry to hear about your experience. Please reach out to us at uhcmobile@uhc.com so we can better assist you.,13271252.0,2020-02-03T17:25:58Z
False,This app makes it easy to find a provider in the area. The ability to see others with the same insurance helps me determine how it might work for me!,Easy app,2019-09-23 04:58:11,5,Abbegayle,,,
True,"Why do I have to change my password all the time! About every other month the app states that my password is incorrect and I have to change it. What gets me angry is that you can’t use passwords already used previously. I’m running out of choices and patience. It’s a health care app, not my bank account. Stop it will you. Now here we are again doing the same thing. Time to delete.",Getting tired,2019-08-19 01:06:09,1,cosres,We value your feedback and we are sorry to hear about your experience. Please reach out to us at uhcmobile@uhc.com so we can better assist you.,8845897.0,2019-08-19T01:06:09Z
False,"I can see my out of pocket deductibles, how much $ before I reach my deductible , how much I have in my health savings plan. Awesome app that’s very user friendly!",Love being able to see everything on one place,2018-11-19 16:07:35,5,"?????????????????,????",,,
False,User friendly!,Easy to maneuver through the website!,2022-03-28 20:02:40,5,Cool Beans68,,,
False,"I never leave reviews but I felt compelled to leave one for the UHC app. As someone with a chronic illness, this app makes my life 100x easier. If you have UHC you need this app!","Amazing, makes insurance a breeze",2021-06-17 03:42:01,5,Coop1002,,,
False,"Since FSA claims are broken on UHC’s browser based form, I thought I would try this app. No luck. There is no option to attach files, only photos. So I took screenshots of my files. Still no luck. Setup to allow photo access is stuck in a loop restarting the form each time I allow access to photos. Just another lousy experience with UHC.",Could not complete a claim,2022-01-16 19:34:56,1,EV Forever!!,,,
False,"This app is easy to use. Excellent for Seniors, font size is great! Most importantly, you don’t have to figure out where to find claims and what was charged to your account.",TRGenus,2020-07-03 11:32:10,5,TGenus,,,
False,This app is very easy to use and understand! If there’s any questions I have it’s easy to access or schedule a call to get help!,So convenient!,2020-06-30 06:10:15,5,misislay,,,
False,Very easy to use with quick access to information I would usually have to call an agent to ask about.,Easy to use,2019-01-08 22:21:44,5,rokout,,,
False,"As a ux designer, I’m very please at the experience of this application. It’s simple to use. There are a couple tho fam issuing I wish it had ex. Export my is card to Apple wallet or book an appoint with a physician  through the app. Otherwise it’s great!",Superb experience,2018-10-01 14:12:26,5,AppGuy_10,,,
False,Well organized and productive app.  I can find what I need from the app easier than I can in the website.,Excellent for reviewing plan,2021-06-16 20:02:18,5,Dcaflorida,,,
False,"Too many menus down
Delayed step results don’t allow you to see steps in real time. Sometimes I have to close app and wait 10 or 15 min to see actual count which holds me at park late and can’t go home in time",Step counter,2022-04-14 17:17:55,3,scardero1,,,
False,"I like the access to medical records and claims, but doing anything else is incredibly difficult. I was looking for a certain program offered by my plan, and I ended up having to go through my browser to get to it. Couldn’t find it in the app at all.",Hard to find what I need,2022-01-17 15:00:18,2,KatieM1998,,,
False,Gives you all the information you need and is very easy to use.,Simple and easy to use,2020-12-17 05:40:00,5,Muuuuu777777,,,
False,"Unable to log in with my user name and password, which work on the website. I called the number for tech support and the agent told me there was no problem, just turn my phone off and on and it will work. I did that, and then uninstalled and reinstalled the app and it still will not allow me to log in",Unable to log in,2021-01-02 20:43:37,1,Ggoddess79,,,
False,"I have been able to find everything I need to know about my insurance, claims, and providers with this app.",So convenient!,2020-12-06 01:21:18,5,Mbqz,,,
False,"App is user friendly. You can schedule televisits right from the app, schedule appointments, view claims, look for pharmacies, and find providers in your area!",Great App,2020-10-11 14:23:09,5,BossC_P,,,
False,We recently moved to UHC from one of the biggest companies in the US. This app bears theirs hands down. I love having my card and so much info available on the app.,Great app!,2020-08-20 00:50:33,5,SadieKY,,,
